<?xml version="1.0" encoding="utf-8"?>
<feed xmlns="http://www.w3.org/2005/Atom">
    <id>https://wiki.olympusgg.com/changelogs</id>
    <title>Olympus Wiki Blog</title>
    <updated>2022-07-27T00:00:00.000Z</updated>
    <generator>https://github.com/jpmonette/feed</generator>
    <link rel="alternate" href="https://wiki.olympusgg.com/changelogs"/>
    <subtitle>Olympus Wiki Blog</subtitle>
    <icon>https://wiki.olympusgg.com/img/favicon.ico</icon>
    <entry>
        <title type="html"><![CDATA[Changelog - 27/07/2022]]></title>
        <id>2022-07-27-changelog</id>
        <link href="https://wiki.olympusgg.com/changelogs/2022-07-27-changelog"/>
        <updated>2022-07-27T00:00:00.000Z</updated>
        <summary type="html"><![CDATA[27/07/2022 - 1030ST)]]></summary>
        <content type="html"><![CDATA[<blockquote><p>27/07/2022 - 10:30 (8:30ST) <br>
Server Version: 1.346.0 <br>
Client Version: 1.131.0 <br></p></blockquote><h2 class="anchor anchorWithStickyNavbar_mojV" id="changes">Changes<a class="hash-link" href="#changes" title="Direct link to heading">​</a></h2><ul><li>Changed Scout's "Ambush" Attacks to reveal itself even while missing </li><li>Removed "NosMate Trainer" from Ituros' Shop</li></ul><h2 class="anchor anchorWithStickyNavbar_mojV" id="fixes">Fixes<a class="hash-link" href="#fixes" title="Direct link to heading">​</a></h2><ul><li>Fixed a visual bug where all skills would be reset when a partner leveled up</li><li>Fixed a bug where signposts would not be removed when logging out</li></ul><p>Sorry for the lack of updates these last 2 weeks, but don't worry, the update coming this weekend should be much bigger</p>]]></content>
        <author>
            <name>Protect</name>
        </author>
        <category label="changelog" term="changelog"/>
        <category label="changes" term="changes"/>
        <category label="balances" term="balances"/>
        <category label="fixes" term="fixes"/>
    </entry>
    <entry>
        <title type="html"><![CDATA[Changelog - 11/07/2022]]></title>
        <id>2022-07-11-changelog</id>
        <link href="https://wiki.olympusgg.com/changelogs/2022-07-11-changelog"/>
        <updated>2022-07-11T00:00:00.000Z</updated>
        <summary type="html"><![CDATA[11/07/2022 - 845 ST)]]></summary>
        <content type="html"><![CDATA[<blockquote><p>11/07/2022 - 8:45 (6:45 ST)<br>
<!-- -->Server Version: 1.341.0<br>
<!-- -->Client Version: 1.1128.0  </p></blockquote><h2 class="anchor anchorWithStickyNavbar_mojV" id="changes">Changes<a class="hash-link" href="#changes" title="Direct link to heading">​</a></h2><ul><li>Renamed Owlbear Steak to Glazed Steak, changed its healing 5k-&gt;10k HP and 2k-&gt;10k MP.</li><li>Added 90Lv. and 92Lv. r5+7 equipment to Teoman's Shop.</li><li>Added new recipe for Alchemist's Beverage to Ituros' Supermarket.</li><li>Replaced Prota near Act4 dungeon entrance.</li></ul><h2 class="anchor anchorWithStickyNavbar_mojV" id="balances">Balances<a class="hash-link" href="#balances" title="Direct link to heading">​</a></h2><ul><li>Reduced gold drops from Belial and Carno from ~150k per drop to ~95k per drop.</li><li>Changed the amount of Carno Runestone in Beast King Carno's raidbox from 1x to 2x.</li></ul><h2 class="anchor anchorWithStickyNavbar_mojV" id="fixes">Fixes<a class="hash-link" href="#fixes" title="Direct link to heading">​</a></h2><ul><li>Fixed Bone Warrior Ragnar's Shadowfall debuff chance and non-elemental damage increasing effect.</li><li>Fixed Bone Warrior Ragnar's Spectral Strike (S) "No HP consumption" effect.</li><li>Fixed Piercing Gaze increasing damage for all hits instead of just critical hits.</li><li>Fixed Athena's Aegis III anti-effect.</li><li>Fixed Helm of Darkness and Athena's Aegis major trophies not being upgradable.</li><li>Fixed Spirit Splinter with Mark of Death not causing critical.</li><li>Fixed Elemental Leech critical effect.</li><li>Fixed Fafnir's Fried Dinner did not have cooldown on Act4.</li></ul>]]></content>
        <author>
            <name>Jundi</name>
        </author>
        <category label="changelog" term="changelog"/>
        <category label="changes" term="changes"/>
        <category label="balances" term="balances"/>
        <category label="fixes" term="fixes"/>
    </entry>
    <entry>
        <title type="html"><![CDATA[Act7 Release Changelog - 02/07/2022]]></title>
        <id>2022-07-02-changelog</id>
        <link href="https://wiki.olympusgg.com/changelogs/2022-07-02-changelog"/>
        <updated>2022-07-02T00:00:00.000Z</updated>
        <summary type="html"><![CDATA[---]]></summary>
        <content type="html"><![CDATA[<hr><p align="center"><img src="https://media.discordapp.net/attachments/959421753703161876/992429223308431370/Banner_Olympus.png"></p><h2 class="anchor anchorWithStickyNavbar_mojV" id="balances">Balances<a class="hash-link" href="#balances" title="Direct link to heading">​</a></h2><p>QoL and other improvements have been made to early game elements.
We wanted to address certain issues with quests to make them go even smoother so that you can start enjoying Act7 sooner if you aren't caught up on the endgame yet.</p><ul><li>Placed a free SP1 30Lv. Advancement Box.</li><li>Placed 95 r5+7 equipment set in 95Lv. Advancement Box.</li><li>Increased 55TS exp reward so that finishing Act1 brings you to level 85 instead of 83.</li><li>Increased some exp rewards from Act5.2 questline.</li><li>Replaced the raid completion quests from Act5.2 questline with mini-boss kill quests.</li><li>Removed the raid completion quests from Act6.1 questline.</li><li>Reduced the cooldown of "Capture" skill from 30s to 7s.</li><li>Reduced the cost of NPC buffers for lower levels:<ul><li>Adventurer Lesser: 50k -&gt; Free</li><li>Adventurer Common: 125k -&gt; 50k</li><li>Hero Lesser: 100k -&gt; 50k</li><li>Hero Common: 250k -&gt; 100k</li></ul></li></ul><p>There are also a few things that had to get patched for a better compatibility with Act7.
This includes nerfing the res reduction of Pix to balance res drain builds, and doubling Caligor durability so that more people can gather enough participation points.
Also, we wanted to make Jennifer hat be equal to our latest Ceremonial Hat from Act7, and be obtainable from Rainbow Random Boxes to make RBB a bit more rewarding.</p><ul><li><p>Reduced Mysterious Traveller's respawn timer from 2h to 1h.</p></li><li><p>Added Jennifer's Feathered Hat to the Rainbow Random Box as a very rare loot.</p></li><li><p>Jennifer's Feathered Hat:</p><ul><li>Defense: 0/0/0 -&gt; 50/50/50</li><li>Dodge: 0 -&gt; 40</li><li><span style="color:#ff862c">Up to level 4 there is a 10% -&gt; 15% chance of never getting a bad effect.</span></li><li><font color="orange">[NEW]</font> <span style="color:#ff862c">Damage received in PvP is decreased by 10%.</span></li></ul></li><li><p>[Pix' Blessing]<!-- -->:</p><ul><li><span style="color:#ff862c">Reduces the enemy's elemental resistances by 10 -&gt; 7.</span></li><li><span style="color:#ff862c">The equipped fairy's element increases by 5 -&gt; 7.</span></li></ul></li><li><p>Chronos Hourglass (I/II/III):</p><ul><li><font color="#fd4949">[REMOVE]</font> <span style="color:#ff862c">There's a 50/75/100% chance to ignore 10/15/60% of the target's defence.</span></li><li><font color="orange">[NEW]</font> <span style="color:#ff862c">Decreases enemy's defense by 5/10/20%.</span></li></ul></li><li><p>Doubled Caligor's durability with damage reduction readjustments:</p><ul><li><span style="color:#ff862c">There is a 100% chance that damage received from melee attacks is reduced by 50 -&gt; 75%.</span></li><li><span style="color:#ff862c">There is a 100% chance that damage received from ranged attacks is reduced by 80 -&gt; 90%.</span></li><li><span style="color:#ff862c">There is a 100% chance that damage received from magic attacks is reduced by 40 -&gt; 70%.</span><br><br></li></ul></li><li><img src="https://cdn.olympusgg.com/images/10163.png" width="15px"> [Despair]:<br>- Duration: 25s -&gt; 10s<br><br></li><li><img src="https://cdn.olympusgg.com/images/10163.png" width="15px"> [Incapacitated]:<br>- <font color="#fd4949">[REMOVE]</font> <span style="color:#ff862c">Calculated Attack Level 0</span><br>- <font color="#fd4949">[REMOVE]</font> <span style="color:#ff862c">Calculated Defense Level 0</span><br>- <font color="orange">[NEW]</font> <span style="color:#ff862c">Attack level is decreased by 7.</span><br><br></li><li><img src="https://cdn.olympusgg.com/images/10191.png" width="15px"> [Cut]:<br>- <span style="color:#ff862c">Reduces remaining MP by 70% -&gt; 50%</span><br><br></li><li><img src="https://cdn.olympusgg.com/images/10140.png" width="15px"> [Fatal Bleeding]:<br>- <font color="orange">[NEW]</font> <span style="color:#ff862c">Magic attacks are reduced by 20%.</span><br><br></li><li><img src="https://cdn.olympusgg.com/images/10189.png" width="15px"> [Cold]:<br>- 5 -&gt; 4Lv. Debuff</li></ul><h2 class="anchor anchorWithStickyNavbar_mojV" id="act71">Act7.1<a class="hash-link" href="#act71" title="Direct link to heading">​</a></h2><p>The Act7.1 is finally here with 17 new maps, 3 new raids, 3 new trophies, tattoos, runes, and much more!
Maximum champion level has been increased from 50 to 60.
Moritius (Act7) can be accessed by starting the questline from Merchant Ben in Alveus Port, if you're already CLv.30+.
Following the questline will unlock you access to Celestial Spire, Act7 raids, three side quests, and seven daily quests.
Since the questline is essential to the Act, we have tried to do some improvements on the it to make it more enjoyable and rewarding.
Additionally, useless side/daily quests of Act7 are removed so you won't have a clutter of trash quests stuck with your character.
Three of the remaining seven dailies are unlocked as you finish the raid quests in the main questline, and the quests are just killing mobs to get raid seals.
Other four dailies are gated behind side quests, which all get unlocked upon completing the Act7.1 questline.
Finishing those side quests will unlock you the four dailies that you can do to get materials and even CExp.</p><h3 class="anchor anchorWithStickyNavbar_mojV" id="farming">Farming<a class="hash-link" href="#farming" title="Direct link to heading">​</a></h3><p>Mob placements and mob counts in almost all maps have been reworked.
Some changes were design-related mob type replacements and removals, and some were for making certain maps feel a bit more rewarding to farm.
Mobs in each map now have a specific drop used in equipment crafts but they drop quite often so you won't feel forced to farm in non-preferred maps for long.
You can use our newest feature to check the mob and map drops in Act7 yourself.</p><p>Four rifts have been placed in Act7: Spirit Forest, Beast Lair, Polluted Forest, and Celestial Spire V.
The rifts at Celestial Spire V is special cause once you get in, you can teleport/warp freely to all 5 floors of the Spire within the rift.</p><h3 class="anchor anchorWithStickyNavbar_mojV" id="raids">Raids<a class="hash-link" href="#raids" title="Direct link to heading">​</a></h3><p>Though we haven't touched the mechanics of our new three raids, they have been repurposed in some way, considering their default situation.
In a nutshell: Spirit King Kirollas for tattoos, Beast King Carno for runes, Demon God Belial for equipment.
Of course, they're all meant to be "worth", as long as you have use for the materials that they give, and they can still be subject to rate changes after we gather enough data and feedback.
We know that once people are done with their main grind, focus of the community may shift to the most profitable raid.
But this is simply a way to give them a specific purpose and also to make higher rune and tattoo upgrades possible and relevant.</p><h3 class="anchor anchorWithStickyNavbar_mojV" id="runes-and-tattooes">Runes and Tattooes<a class="hash-link" href="#runes-and-tattooes" title="Direct link to heading">​</a></h3><p>You can access the rune guide here: <a href="https://wiki.olympusgg.com/information/runes" target="_blank" rel="noopener noreferrer">Click</a><br>
You can access the tattoo guide here: <a href="https://wiki.olympusgg.com/information/tattoos" target="_blank" rel="noopener noreferrer">Click</a><br><br>
The protection scrolls and removal items can be found in Logotor's Equipment Shop.
Logotor also sells two brand new items: Tattoo Switch Scroll and Loa Switch Crystal.
These can be used to switch your tattoo and/or your loa, without losing your upgrade level.
We wanted to encourage our players trying new builds through different tattooes so that tattooes won't feel too repetitive or bland.</p><h3 class="anchor anchorWithStickyNavbar_mojV" id="equipment--trophies">Equipment &amp; Trophies<a class="hash-link" href="#equipment--trophies" title="Direct link to heading">​</a></h3><p>You can access the equipment guide here: <a href="https://wiki.olympusgg.com/guides/act7-equipment" target="_blank" rel="noopener noreferrer">Click</a><br><br>
Three new trophies are added to Mysterious Monk.
These trophies are meant to be PvP-oriented, even though our previous ones had functions in PvP too, we wanted a specialized generation of PvP trophies.
They can basically be classified as: offense for Vengeful Tombstone, defense for Athena's Aegis, mixed for Helm of Darkness.
We will be looking forward to see their place in the game and rebalance them if needed.</p><h2 class="anchor anchorWithStickyNavbar_mojV" id="valhalla">Valhalla<a class="hash-link" href="#valhalla" title="Direct link to heading">​</a></h2><p>Valhalla Part1 &amp; Part2 has been implemented.
These quests are mainly an alternative for solo levelling without having to farm in Act5.2 or LoD.
Part1 questline can be started by Barni's Soul in NosVille near God's Altar at 85Lv. It'll bring you to Lv.90 by its end.
After completing Part1, Part2 quests can be obtained from Ragnar at the entrance of Rock Cliff.
Finishing Valhalla Part2 and Act5.2 questlines will bring you near 99Lv.
These quests are mainly an alternative for new players to level up solo without having to farm in Act5.2 or LoD. You'll still need to farm though, to get enough resources to build a character.</p><p>Fafnir Raid &amp; achievements have been implemented.
Key to Fafnir's Castle can be bought from the Mysterious Monk in NosVille or can be dropped by the monsters in Midgard just north of Maple Woods.
Raid entrance is on the Castle Aria Int. map, near Midgard.
In the raidbox, you can find divine fairies, fairy essences, Viking costumes, and even an Unidentified Egg that randomly turns into Zenas or Erenia's Egg.
As a percentage raid, the raid is made fast and easy. Consequently, the chance for rare loots mentioned above had to be kept low.
It also contains Fafnir's Fried Dinner which can be used to cleanse Lv.3 and lower debuffs in all sorts of situations.
All things considered, we think it's worthy to do some Fafnir maras for an easy flow of direct gold if not for all the rare loot.</p><h2 class="anchor anchorWithStickyNavbar_mojV" id="sp-changes">SP Changes<a class="hash-link" href="#sp-changes" title="Direct link to heading">​</a></h2><p>You can access the changelog for SPs here: <a href="https://wiki.olympusgg.com/release-reworks/act7-sp-changelog" target="_blank" rel="noopener noreferrer">Click</a><br><br></p>]]></content>
        <author>
            <name>Jundi</name>
        </author>
        <category label="changelog" term="changelog"/>
        <category label="changes" term="changes"/>
        <category label="fixes" term="fixes"/>
        <category label="act7" term="act7"/>
        <category label="release" term="release"/>
        <category label="update" term="update"/>
    </entry>
    <entry>
        <title type="html"><![CDATA[Changelog - 26/06/2022]]></title>
        <id>2022-06-26-changelog</id>
        <link href="https://wiki.olympusgg.com/changelogs/2022-06-26-changelog"/>
        <updated>2022-06-26T00:00:00.000Z</updated>
        <summary type="html"><![CDATA[26/06/2022 - 15:00 ST]]></summary>
        <content type="html"><![CDATA[<blockquote><p>26/06/2022 - 15:00 ST<br>
<!-- -->Server Version: 1.321.0<br>
<!-- -->Client Version: 1.116.0   </p></blockquote><h1>Fixes</h1><ul><li>Fixed a bug where dying in Caligor would sometimes count as multiple deaths</li><li>Fixed wrong descriptions of achievements "Burning Sword (Daily)" and "Burning Sword (Weekly)"</li><li>Fixed a bug where your characters would sometimes not be able to move on certain maps</li><li>Fixed a bug where your character would sometimes get stuck after dying</li></ul><h1>Event</h1><ul><li>Elemental Event has ended</li><li>A +50% exp event has started and will end with the release of act 7</li></ul>]]></content>
        <author>
            <name>Jundi</name>
        </author>
        <category label="changelog" term="changelog"/>
        <category label="changes" term="changes"/>
        <category label="fixes" term="fixes"/>
        <category label="event" term="event"/>
        <category label="caligor" term="caligor"/>
    </entry>
    <entry>
        <title type="html"><![CDATA[Changelog - 22/06/2022]]></title>
        <id>2022-06-22-changelog</id>
        <link href="https://wiki.olympusgg.com/changelogs/2022-06-22-changelog"/>
        <updated>2022-06-22T00:00:00.000Z</updated>
        <summary type="html"><![CDATA[22/06/2022 - 19h00 (17h00 ST)]]></summary>
        <content type="html"><![CDATA[<blockquote><p>22/06/2022 - 19h00 (17h00 ST)<br>
<!-- -->Server Version: 1.319.0<br>
<!-- -->Client Version: 1.114.0 </p></blockquote><h1>Changes</h1><ul><li>Made Zenas not absorb her summons too fast</li><li>Made Seer's Shadow Clones untargettable</li></ul><h1>Fixes</h1><ul><li>Fixed character icons in damage meter when transformed by a raid boss</li><li>Fixed Onyx Shadow not working with self-targeted AoE skills</li><li>Fixed buffs (from NPC buffer) being removed from partners upon removing PSP</li></ul>]]></content>
        <author>
            <name>Jundi</name>
        </author>
        <category label="changelog" term="changelog"/>
        <category label="changes" term="changes"/>
        <category label="fixes" term="fixes"/>
    </entry>
    <entry>
        <title type="html"><![CDATA[Changelog - 19/06/2022]]></title>
        <id>2022-06-19-changelog</id>
        <link href="https://wiki.olympusgg.com/changelogs/2022-06-19-changelog"/>
        <updated>2022-06-19T00:00:00.000Z</updated>
        <summary type="html"><![CDATA[19/06/2022 - 15h45 (13h45 ST)]]></summary>
        <content type="html"><![CDATA[<blockquote><p>19/06/2022 - 15h45 (13h45 ST)<br>
<!-- -->Server Version: 1.317.0<br>
<!-- -->Client Version: 1.112.0</p></blockquote><h1>QoL</h1><ul><li>The "FPS Unlock" option will now be saved when logging out</li><li>The drop chance will now be displayed next to the drop names for the map drops</li><li>Map drops will now be ordered by drop chance</li><li>Ancelloan Blessings are now stackable</li><li>Fairy Boosters are now stackable</li><li>Fairy Exp potions are now stackable</li><li>Soulstone blessings are now stackable</li><li>Guardian Angel's blessings are now stackable</li><li>Partner skills will now also be reset at the end of a raid</li></ul><h1>Fixes</h1><ul><li>The achievement "Elemental Enlightment (Daily)" can now be completed in rifts with auto-loot enabled</li><li>Fixed an exception causing an error message to show up when using Home System in act 4 </li><li>Pets &amp; partners will now keep NPC buffer buffs when relogging</li><li>When equipping a PSP, partners will not lose their NPC Buffer buffs anymore</li></ul><h1>Changes</h1><ul><li>Used amulets cannot be put in bazaar anymore</li><li>Talent Arena will now happen on channel 1</li></ul><h1>Features</h1><ul><li>Introducing the first version of the raid DPS meter</li></ul>]]></content>
        <author>
            <name>Jundi</name>
        </author>
        <category label="changelog" term="changelog"/>
        <category label="changes" term="changes"/>
        <category label="features" term="features"/>
        <category label="fixes" term="fixes"/>
        <category label="dmg" term="dmg"/>
        <category label="meter" term="meter"/>
    </entry>
    <entry>
        <title type="html"><![CDATA[Changelog - 06/06/2022]]></title>
        <id>2022-06-06-changelog</id>
        <link href="https://wiki.olympusgg.com/changelogs/2022-06-06-changelog"/>
        <updated>2022-06-06T00:00:00.000Z</updated>
        <summary type="html"><![CDATA[06/06/2022 - 1830 ST)]]></summary>
        <content type="html"><![CDATA[<blockquote><p>06/06/2022 - 18:30 (16:30 ST)<br>
<!-- -->Server Version: 1.307.0<br>
<!-- -->Client Version: 1.104.0       </p></blockquote><h1>Fixes</h1><ul><li>Fixed r8 shell research in bazaar</li><li>Fixed return points in act4 with infinite amulet</li><li>Fixed a bug where your character would sometimes get stuck after a respawn</li><li>Fixed Chicken King family mission</li></ul><h1>Changes</h1><ul><li>It's now impossible to remove your specialist card inside of talent arena</li><li>Reduced the amount of monsters inside 81Lv. TimeSpace</li></ul>]]></content>
        <author>
            <name>Jundi</name>
        </author>
        <category label="changelog" term="changelog"/>
        <category label="changes" term="changes"/>
        <category label="features" term="features"/>
        <category label="fixes" term="fixes"/>
    </entry>
    <entry>
        <title type="html"><![CDATA[Changelog - 22/05/2022]]></title>
        <id>2022-05-22-changelog</id>
        <link href="https://wiki.olympusgg.com/changelogs/2022-05-22-changelog"/>
        <updated>2022-05-22T00:00:00.000Z</updated>
        <summary type="html"><![CDATA[22/05/2022 - 2200 ST)]]></summary>
        <content type="html"><![CDATA[<blockquote><p>22/05/2022 - 22:00 (20:00 ST)<br>
<!-- -->Server Version: 1.226.0<br>
<!-- -->Client Version: 1.97.0        </p></blockquote><h1>Fixes</h1><ul><li>Fixed family warehouse</li><li>Fixed a bug where you could bet items that were not armors or weapons</li><li>Fixed a bug in arena of talents where your buffs would be removed everytime you enter the fighting area</li><li>Fixed a bug where you wouldn't be able to use the act 6.2 ship if you had the family bonus supposed to reduce ship cost</li></ul><h1>Changes</h1><ul><li>Divine potions are now usable in angel &amp; demon citadels</li><li>Added new speedbooster recipes at Hatem</li></ul><h1>Features</h1><ul><li>Added Event Management Window (first version, will be improved in the future based on feedback)</li></ul>]]></content>
        <author>
            <name>Jundi</name>
        </author>
        <category label="changelog" term="changelog"/>
        <category label="changes" term="changes"/>
        <category label="features" term="features"/>
        <category label="fixes" term="fixes"/>
    </entry>
    <entry>
        <title type="html"><![CDATA[Changelog - 16/05/2022]]></title>
        <id>2022-05-16-changelog</id>
        <link href="https://wiki.olympusgg.com/changelogs/2022-05-16-changelog"/>
        <updated>2022-05-16T00:00:00.000Z</updated>
        <summary type="html"><![CDATA[16/05/2022 - 2115 ST)]]></summary>
        <content type="html"><![CDATA[<blockquote><p>16/05/2022 - 21:15 (19:15 ST)<br>
<!-- -->Server Version: 1.222.0<br>
<!-- -->Client Version: 1.95.0   </p></blockquote><h1>Bug fixes</h1><ul><li>Onyx Shadow were sometimes not correctly removed from minimap</li><li>Fixed right click on costumes on bazaar</li><li>Fixed a bug for family level 16/17</li><li>Fixed Act4 Demon ship timing were not correct</li></ul><h1>Changes</h1><ul><li>Added remaining time to warp cooldown message</li><li>Added Fairy essences as potential rewards in mysterious box of completion</li></ul>]]></content>
        <author>
            <name>Jundi</name>
        </author>
        <category label="changelog" term="changelog"/>
        <category label="changes" term="changes"/>
        <category label="qol" term="qol"/>
        <category label="fixes" term="fixes"/>
        <category label="easter event" term="easter event"/>
    </entry>
    <entry>
        <title type="html"><![CDATA[Changelog - 09/05/2022]]></title>
        <id>2022-05-09-changelog</id>
        <link href="https://wiki.olympusgg.com/changelogs/2022-05-09-changelog"/>
        <updated>2022-05-09T00:00:00.000Z</updated>
        <summary type="html"><![CDATA[09/05/2022 - 2100 ST)]]></summary>
        <content type="html"><![CDATA[<blockquote><p>09/05/2022 - 21:00 (19:00 ST)<br>
<!-- -->Server Version: 1.215.0<br>
<!-- -->Client Version: 1.92.0   </p></blockquote><h2 class="anchor anchorWithStickyNavbar_mojV" id="changes">Changes<a class="hash-link" href="#changes" title="Direct link to heading">​</a></h2><ul><li>Act 4 Ship Duration: 5mn -&gt; 2mn</li><li>Easter Event has ended, the following items have been deleted<ul><li>Mad March Hare Raid Seal</li><li>Chicken Queen Seal (Event)</li><li>Red Easter Egg (Event)</li><li>Magic Egg (Event)</li><li>Chocolate Rabbit (Event)</li><li>Chicken Queen's Feather (Event)</li><li>Easter Cake Slide (Event)</li><li>Rotten Egg (Event)</li><li>Cleansed Egg (Event)</li><li>Mad March Hare Raid Box</li><li>Chicken Queen Raid Box</li></ul></li></ul><h2 class="anchor anchorWithStickyNavbar_mojV" id="balance">Balance<a class="hash-link" href="#balance" title="Direct link to heading">​</a></h2><h3 class="anchor anchorWithStickyNavbar_mojV" id="-swordsman"><img src="https://cdn.olympusgg.com/images/32040.png" width="35px"> Swordsman<a class="hash-link" href="#-swordsman" title="Direct link to heading">​</a></h3><ul><li><h4 class="anchor anchorWithStickyNavbar_mojV" id="-gladiator"><img src="https://cdn.olympusgg.com/images/2544.png" width="25px"> Gladiator<a class="hash-link" href="#-gladiator" title="Direct link to heading">​</a></h4><ul><li><strong><img src="https://cdn.olympusgg.com/images/10252.png" width="15px"> <!-- -->[Engorgement]</strong>: <ul><li><span style="color:#ff862c">Hit rate is increased by (Player Level x2 -&gt; 1)</span></li><li><strong><img src="https://cdn.olympusgg.com/images/10251.png" width="15px"> <!-- -->[Shaky Status]</strong>:<ul><li><span style="color:#ff862c">Dodging of melee attacks is decreased by 200 -&gt; 300</span></li></ul></li></ul></li></ul></li><li><h4 class="anchor anchorWithStickyNavbar_mojV" id="-death-reaper"><img src="https://cdn.olympusgg.com/images/2654.png" width="25px"> Death Reaper:<a class="hash-link" href="#-death-reaper" title="Direct link to heading">​</a></h4><ul><li><strong><img src="https://cdn.olympusgg.com/images/6105.png" width="15px"> <!-- -->[Infinite Armour]</strong>:<ul><li><font color="#f5c478">Cooldown: 60s -&gt; 90s</font></li></ul></li></ul></li></ul><h3 class="anchor anchorWithStickyNavbar_mojV" id="-archer"><img src="https://cdn.olympusgg.com/images/32100.png" width="35px"> Archer<a class="hash-link" href="#-archer" title="Direct link to heading">​</a></h3><ul><li><h4 class="anchor anchorWithStickyNavbar_mojV" id="-assassin"><img src="https://cdn.olympusgg.com/images/904.png" width="25px"> Assassin:<a class="hash-link" href="#-assassin" title="Direct link to heading">​</a></h4><ul><li><strong><img src="https://cdn.olympusgg.com/images/5849.png" width="15px"> <!-- -->[Tumble]</strong>:<ul><li><font color="#f5c478">Cooldown: 7s -&gt; 9s</font></li></ul></li><li><strong><img src="https://cdn.olympusgg.com/images/5851.png" width="15px"> <!-- -->[Shadow]</strong>:<ul><li>[Removed]<!-- --> <span style="color:#ff862c">Chance of inflicting critical hits is increased by 10%</span></li><li><font color="#f5c478">Cooldown 25s -&gt; 35s</font></li></ul></li></ul></li></ul><h3 class="anchor anchorWithStickyNavbar_mojV" id="-mage"><img src="https://cdn.olympusgg.com/images/32120.png" width="35px"> Mage<a class="hash-link" href="#-mage" title="Direct link to heading">​</a></h3><ul><li><h4 class="anchor anchorWithStickyNavbar_mojV" id="-seer"><img src="https://cdn.olympusgg.com/images/2656.png" width="25px"> Seer:<a class="hash-link" href="#-seer" title="Direct link to heading">​</a></h4><ul><li><strong><img src="https://cdn.olympusgg.com/images/6126.png" width="15px"> <!-- -->[Blink]</strong>: <ul><li><strong><img src="https://cdn.olympusgg.com/images/10371.png" width="15px"> <!-- -->[Armour of Darkness]</strong>:       <ul><li><span style="color:#ff862c">Non-elemental damage is decreased by 15% -&gt; 25%</span></li></ul></li></ul></li></ul></li><li><h4 class="anchor anchorWithStickyNavbar_mojV" id="dark-gunner"><img src="https://cdn.olympusgg.com/images/914.png" width="25px">Dark Gunner:<a class="hash-link" href="#dark-gunner" title="Direct link to heading">​</a></h4><ul><li><strong><img src="https://cdn.olympusgg.com/images/5949.png" width="15px"> <!-- -->[Dark Force]</strong>:<ul><li><span style="color:#ff862c">Probability to receive Critical Hits is decreased by 5% -&gt; 10%</span></li></ul></li><li><strong><img src="https://cdn.olympusgg.com/images/5947.png" width="15px"> <!-- -->[Ghost Guard]</strong>:   <ul><li><span style="color:#ff862c">Chance of inflicting critical hits is increased by 15% -&gt; 20%</span></li></ul></li></ul></li></ul>]]></content>
        <author>
            <name>Jundi</name>
        </author>
        <category label="changelog" term="changelog"/>
        <category label="changes" term="changes"/>
        <category label="qol" term="qol"/>
        <category label="fixes" term="fixes"/>
        <category label="easter event" term="easter event"/>
    </entry>
    <entry>
        <title type="html"><![CDATA[Changelog - 01/05/2022]]></title>
        <id>2022-05-01-changelog</id>
        <link href="https://wiki.olympusgg.com/changelogs/2022-05-01-changelog"/>
        <updated>2022-05-01T00:00:00.000Z</updated>
        <summary type="html"><![CDATA[01/05/2022 - 1930 ST)]]></summary>
        <content type="html"><![CDATA[<blockquote><p>01/05/2022 - 19:30 (17:30 ST)
Server Version: 1.204.0
Client Version: 1.86.0  </p></blockquote><h1>Fixes</h1><ul><li>Fixed a bug with chicken sp scroll where it would consume "small ruby of completion" when upgrading over +15</li><li>Fixed a bug with chicken sp scroll window closing everytime after an upgrade attempt</li><li>Fixed a bug where you would be able to upgrade your chicken sp without scrolls in a certain scenario</li><li>Fixed a bug where sp upgrade window would close when upgrading from +15 to +16 with the Divine SP Scroll</li><li>Fixed damage of the Chicken Queen summons</li><li>Fixed chicken sp scroll closing itself when upgrading from +15 to +16</li><li>Fixed wings &amp; amulets of return not working properly</li></ul><h1>Quality of Life</h1><ul><li>Debuffs will now be removed after a raid is completed</li><li>Skill cooldowns will now be reset after a raid is completed</li></ul><h1>Changes</h1><ul><li>Added loyalty coins to Chicken Queen &amp; Mad March Hare raids</li><li>Renamed "Spooky Imp" to "Pix"</li><li>All languages except english have been removed ($language command won't work anymore)</li><li>Warp &amp; Amulet/Wing of return are now under cooldown restriction on a list of specific maps: (we will continue to monitor the situation and will change some more things if needed to discourage multi map farming)<ul><li>Heaven's Gate 4</li><li>Heaven's Ruins 1</li><li>Heaven's Ruins 2</li><li>Hell's Gate 4</li><li>Hell's Ruins 1</li><li>Hell's Ruins 2</li><li>Ancelloan's Will 2</li><li>Ancelloan's Will 5</li><li>Katol's Street</li><li>Eastern Path</li><li>Western Path</li></ul></li></ul>]]></content>
        <author>
            <name>Vee</name>
        </author>
        <category label="changelog" term="changelog"/>
        <category label="changes" term="changes"/>
        <category label="fixes" term="fixes"/>
        <category label="easter event" term="easter event"/>
    </entry>
    <entry>
        <title type="html"><![CDATA[Changelog - 30/04/2022]]></title>
        <id>2022-04-30-changelog</id>
        <link href="https://wiki.olympusgg.com/changelogs/2022-04-30-changelog"/>
        <updated>2022-04-30T00:00:00.000Z</updated>
        <summary type="html"><![CDATA[30/04/2022 - 0000 ST)]]></summary>
        <content type="html"><![CDATA[<blockquote><p>30/04/2022 - 00:00 (22:00 ST)<br>
<!-- -->Server Version: 1.202.0<br>
<!-- -->Client Version: 1.84.0    </p></blockquote><h1>Changes</h1><ul><li>Made Fernon portal permanently visible to avoid confusion.</li><li>Fernon Raid Seal can now be used even when Fernon raid is closed so teams can prepare in advance. </li><li>Changed required level for Event Achievements from 80 to 95 due to mass abuse.</li><li>Readjusted Laurena's Accessories to have damage modifiers instead of PvP bonuses.</li><li>Changed Yuna the Magic Student's buff Heart Pound to heal in flat amounts instead of percentage:<ul><li>Every 4 seconds: 2/3/4/5/6/7/10% -&gt; (3/5/8/10/12/15/25 x Partner Level) HP is recovered.</li></ul></li></ul><h1>Bug fixes</h1><ul><li>Fixed pet buffs being removed when removing a PSP.</li><li>Fixed Mysterious Eggs being able to get buffs that would increase their maximum HP.</li><li>Fixed gold shells and gold increasing effects not working with autoloot in solo rifts. </li><li>Fixed pets &amp; partners being able to attack a target while it's jumping (Lord Draco, Chicken King, etc.)</li><li>Fixed pets &amp; partners being able to attack their own factions' guardians.</li><li>Fixed summoned monsters like Onyx causing instant death in Ice Breaker.</li></ul>]]></content>
        <author>
            <name>Jundi</name>
        </author>
        <category label="changelog" term="changelog"/>
        <category label="changes" term="changes"/>
        <category label="fixes" term="fixes"/>
        <category label="easter event" term="easter event"/>
    </entry>
    <entry>
        <title type="html"><![CDATA[Changelog - 24/04/2022]]></title>
        <id>2022-04-24-changelog</id>
        <link href="https://wiki.olympusgg.com/changelogs/2022-04-24-changelog"/>
        <updated>2022-04-24T00:00:00.000Z</updated>
        <summary type="html"><![CDATA[24/04/2022 - 2000 ST)]]></summary>
        <content type="html"><![CDATA[<blockquote><p>24/04/2022 - 20:00 (18:00 ST)<br>
<!-- -->Server Version: 1.196.0<br>
<!-- -->Client Version: 1.81.0   </p></blockquote><h1>Easter Event (check #announcements on Discord)</h1><ul><li>Mad March Raid</li><li>Chicken Queen Raid</li></ul><h1>Features</h1><ul><li>Added Chicken King as a fun raid</li></ul><h1>QoL</h1><ul><li>New Perfection Window (Do mass perfection on one click)</li><li>New Betting Window (Do automatic betting until you get the rarity you wanted)</li><li>Added Auto loot in solo Rifts</li><li>Added milliseconds to raid completion time</li></ul><h1>Bug fixes</h1><ul><li>Caligor Death issue that would lead you to get a "Your client will be closed" issue</li><li>NosMate visibility could be bugged on map changes</li><li>Hero IC could not be finished under certain scenario</li><li>Hero IC was too laggy on the client side, it has been improved</li><li>Fixed divine potions being consumed in act 4 even though they shouldn't be useable</li><li>Fixed Warp couldn't be used instantly on Raid paths</li><li>Fixed an issue with friend chat where you would see your name before every message</li><li>Fixed an issue with auto betting &amp; auto perfection</li><li>Fixed an exploit with mysterious eggs</li><li>Fixed easter costume icon</li><li>Percentage damage raids</li><li>Eva shop</li><li>Bank not opening</li></ul>]]></content>
        <author>
            <name>Jundi</name>
        </author>
        <category label="changelog" term="changelog"/>
        <category label="changes" term="changes"/>
        <category label="qol" term="qol"/>
        <category label="fixes" term="fixes"/>
        <category label="easter event" term="easter event"/>
    </entry>
    <entry>
        <title type="html"><![CDATA[Changelog - 17/04/2022]]></title>
        <id>2022-04-17-changelog</id>
        <link href="https://wiki.olympusgg.com/changelogs/2022-04-17-changelog"/>
        <updated>2022-04-17T00:00:00.000Z</updated>
        <summary type="html"><![CDATA[17/04/2022 - 2200 ST)]]></summary>
        <content type="html"><![CDATA[<blockquote><p>17/04/2022 - 22:00 (20:00 ST)<br>
<!-- -->Server Version: 1.186.0<br>
<!-- -->Client Version: 1.73.0    </p></blockquote><h1>Changes</h1><ul><li>Restricted cross-map warps to avoid abuses (you now have a cooldown)</li><li>Saved the timer for Pocket Dimensions on disconnect (people started abusing it due to the changes in aggro limit, it was not really abuseable before)</li></ul><h1>Bug Fixes</h1><ul><li>Added checks on blacklist for notes due to recent abuses</li><li>Fixed IC monsters being out of map in certain tricky scenario</li></ul><h1>Miscellaneous</h1><ul><li>Fixed #act4-dungeons spam</li><li>Improved the look and functionality of the Wiki <a href="https://wiki.olympusgg.com/" target="_blank" rel="noopener noreferrer">https://wiki.olympusgg.com/</a> (Special thanks to AguitaDeCoCo)</li></ul>]]></content>
        <author>
            <name>Jundi</name>
        </author>
        <category label="changelog" term="changelog"/>
        <category label="qol" term="qol"/>
        <category label="fixes" term="fixes"/>
    </entry>
    <entry>
        <title type="html"><![CDATA[Latest changelogs recap - 10/04/2022]]></title>
        <id>2022-04-10-changelog</id>
        <link href="https://wiki.olympusgg.com/changelogs/2022-04-10-changelog"/>
        <updated>2022-04-10T00:00:00.000Z</updated>
        <summary type="html"><![CDATA[- Added a Notification System. A notification will appear for ingame events such as Caligor, Fernon, item sale on bazaar, and more.]]></summary>
        <content type="html"><![CDATA[<ul><li>Added a Notification System. A notification will appear for ingame events such as Caligor, Fernon, item sale on bazaar, and more.</li><li>C25 -&gt; C45 Equipment Conversion.</li><li>Added a "Safe Upgrading" option.</li><li>Added a new Instant Battle (c25 - c50) - Hard mode.</li></ul><h1>QoL</h1><ul><li>Exp penalty for being in a group is removed.</li><li>Stack size has been increased from 999 to 9999.</li><li>Added UI buttons for Warp and Notifications.</li><li>Partners can now wear hero resistances.</li><li>Increased chances of getting r7/8 through betting.</li><li>Disabled aggro limit in pocket dimensions.</li><li>Increased the sale price of some minor trophies.</li><li>Added new daily &amp; weekly achievements, also increased the rewards for some of the existing ones.</li></ul><h1>Fernon</h1><ul><li>Schedule: Wednesdays, Saturdays, Sundays @ 12:30 &amp; 18:30 ST.</li><li>Changed the sword mechanic back to pulling to allow for faster raids.</li><li>Added <a href="/custom-features/npc-buffers">NPC Buffer</a> in front of Fernon entrance.</li><li>Fernon rewards have been increased.</li></ul><h1>Caligor</h1><ul><li>Schedule: Every day @ 12:00 &amp; 18:00 ST.</li><li>Now requires contribution points to receive rewards.</li><li>The winning team will receive a shell fragment as an extra reward.</li><li>Added Kills / Deaths counter in Caligor.</li></ul><h1>Other Raids</h1><ul><li>Reduced the HP of Zenas &amp; Erenia and other changes to make them faster. Increased the chances of getting the rare rewards.</li><li>A4 dungeons have got increased chance to drop divine fairies, and shell fragments were added to the box.</li></ul>]]></content>
        <author>
            <name>Jundi</name>
        </author>
        <category label="changelog" term="changelog"/>
        <category label="recap" term="recap"/>
        <category label="act6" term="act6"/>
        <category label="balance" term="balance"/>
        <category label="qol" term="qol"/>
    </entry>
    <entry>
        <title type="html"><![CDATA[Act 6.2 Changelog - 19/03/2022]]></title>
        <id>2022-03-19-changelog</id>
        <link href="https://wiki.olympusgg.com/changelogs/2022-03-19-changelog"/>
        <updated>2022-03-19T00:00:00.000Z</updated>
        <summary type="html"><![CDATA[- Implemented followings features:]]></summary>
        <content type="html"><![CDATA[<ul><li>Implemented followings features:<ul><li><a href="/custom-features/hero-shell-system">Caligor</a></li><li><a href="/guides/features/arena-of-talent">Arena of Talents</a></li><li><a href="/custom-features/warp-system">Warp System</a></li><li><a href="/guides/crafting/sp-upgrade">SP Upgrades +16~20</a></li><li>Act6.2</li></ul></li><li>Reworked <a href="/information/equipment-act62-rework">Act6.2 equipment</a>.</li><li>Added "Divine SP Upgrade Scroll" to Travelling Merchant.</li><li>Added "Perfume" to Malcolm Mix.</li><li>Added three new <a href="/custom-features/trophy-system">Major Trophies</a> to "Mysterious Monk".</li><li>Added <a href="/changelogs/guides/crafting/act-6-fairies-craft">Fernon fairy craft</a> recipes to Priest of Transformation.</li><li>Added c50 Lv. Hats recipes to "Graham".</li><li>Added Laurena accessories' recipes to Lilith.</li><li>Increased the mob count in Ancelloan's Will 2 &amp; 5, replaces the Crusaders and Elite Unknown Spirits to other Act6.2 maps.</li><li>Made Holy Blood and Dark Energy Stone tradable.</li><li>Increased hero experience rate by 40%.</li><li>Increased max hero level from 30 to 50.</li><li>Added Unknown Land portal to Bitoren Tundra.</li><li>Rotated Shop and God's Altar rare rewards: Dracula's Costume Set, Crystal Wings, Sports Weapon Skins (Super Rare)</li><li>[DISABLED]<!-- --> Added a new option to Teoman Topp for converting Act6.1 equipment to Act6.2 equipment for a fee. Shell options will be carried over but rarity and upgrade will be reset to r0+0.</li><li>Added r5+7 90 equipment set in Advancement Reward (90Lv.).</li></ul><h1>Shop Rotations</h1><h2 class="anchor anchorWithStickyNavbar_mojV" id="pets">Pets<a class="hash-link" href="#pets" title="Direct link to heading">​</a></h2><ul><li>[REMOVE]<!-- --> Fluffy Bally Random Box</li><li>[NEW]<!-- --> Rudi Rowdy Random Box</li></ul><h2 class="anchor anchorWithStickyNavbar_mojV" id="wings">Wings<a class="hash-link" href="#wings" title="Direct link to heading">​</a></h2><ul><li>[REMOVE]<!-- --> Zephyr Wings Random Box</li><li>[NEW]<!-- --> Onyx Wings Random Box
*You can check the new wings effect in <a href="/information/wings-rework">Wings Rework</a>.</li></ul><h2 class="anchor anchorWithStickyNavbar_mojV" id="psp">PSP<a class="hash-link" href="#psp" title="Direct link to heading">​</a></h2><ul><li>[REMOVE]<!-- --> Harlequin PSP Random Box</li><li>[NEW]<!-- --> Magic Student Yuna PSP Random Box<ul><li>[Retina Damage (S)]<!-- -->:<ul><li>Level: 4 -&gt; 5</li></ul></li><li>[Claw Wound (S)]<!-- -->:<ul><li>Level: 4 -&gt; 5</li></ul></li></ul></li></ul><h1>Altar Rotation</h1><h2 class="anchor anchorWithStickyNavbar_mojV" id="weapon-skins">Weapon Skins<a class="hash-link" href="#weapon-skins" title="Direct link to heading">​</a></h2><ul><li>[REMOVE]<!-- --> 10th Anniversary Cake Knife Skin</li><li>[REMOVE]<!-- --> 10th Anniversary Cake Skin</li><li>[REMOVE]<!-- --> 10th Anniversary Firecracker Skin</li><li>[NEW]<!-- --> Baseball Bat Skin</li><li>[NEW]<!-- --> Recurve Bow Skin</li><li>[NEW]<!-- --> Tenis Racquet Skin
*You can check the new weapon skins' effect in <a href="/information/customized-coinshop">Customized Coin Shop</a>.</li></ul><h2 class="anchor anchorWithStickyNavbar_mojV" id="emotes">Emotes<a class="hash-link" href="#emotes" title="Direct link to heading">​</a></h2><ul><li>[REMOVE]<!-- --> pepega</li><li>[REMOVE]<!-- --> pepoclown</li><li>[NEW]<!-- --> PogYou</li><li>[NEW]<!-- --> doubt</li></ul><h2 class="anchor anchorWithStickyNavbar_mojV" id="other-legendary-loots">Other Legendary Loots<a class="hash-link" href="#other-legendary-loots" title="Direct link to heading">​</a></h2><ul><li>[REMOVE]<!-- --> Magic Jaguar Box</li><li>[REMOVE]<!-- --> Indian Bushi</li><li>[NEW]<!-- --> Dracula Costume Set</li><li>[NEW]<!-- --> Crystal Wings</li></ul><h1>Balance</h1><ul><li>[Spectator]<!-- -->:<ul><li>[REMOVE]<!-- --> Movement speed is increased by 5.</li><li>[NEW]<!-- --> Resists forced movement with a probability of 100%.</li></ul></li><li>Sealed Heavenly Staff:<ul><li>Reduces the enemy's elemental resistances by 19 -&gt; 21.</li></ul></li><li>Sealed Hellord Wand:<ul><li>Reduces the enemy's elemental resistances by 19 -&gt; 21.</li></ul></li><li>Arachnophobe:<ul><li>All dodges are increased by (Player Levelx1 -&gt; /2).</li></ul></li><li>Scorching Webs:<ul><li>[REMOVE]<!-- --> Damage from critical hits is reduced by 10%.</li><li>[NEW]<!-- --> Concentration is increased by (Player Levelx1).</li></ul></li><li>Ancient Scripts I:<ul><li>[REMOVE]<!-- --> All elemental energies are increased by 100.</li><li>[NEW]<!-- --> Increase damage dealt with a probability of 1% by 5%.</li></ul></li><li>Ancient Scripts II:<ul><li>[REMOVE]<!-- --> All elemental energies are increased by 200.</li><li>[NEW]<!-- --> Increase damage dealt with a probability of 1% by 10%.</li></ul></li><li>Ancient Scripts III:<ul><li>[REMOVE]<!-- --> All elemental energies are increased by 300.</li><li>[NEW]<!-- --> Increase damage dealt with a probability of 1% by 15%.</li></ul></li><li>Kertos Leather Chest Armour:<ul><li>Dodge is increased by 100 -&gt; 125.</li></ul></li><li>Sealed Heavenly Leather Armour:<ul><li>Dodge is increased by 100 -&gt; 150.</li></ul></li><li>Sealed Heavenly Leather Armour:<ul><li>Dodge is increased by 100 -&gt; 150.</li></ul></li></ul><h1>SP Changes</h1><h2 class="anchor anchorWithStickyNavbar_mojV" id="destroyer">Destroyer<a class="hash-link" href="#destroyer" title="Direct link to heading">​</a></h2><ul><li>[Visual Impairment]<!-- -->:<ul><li>Hit rate of all attacks is decreased by 150 -&gt; 100.</li></ul></li><li>[Overtrained Body]<!-- -->:<ul><li>[REMOVE]<!-- --> Non-elemental damage received is decreased by 15%.</li><li>[REMOVE]<!-- --> Defense level is increased by 2.</li></ul></li></ul><h2 class="anchor anchorWithStickyNavbar_mojV" id="demon-hunter">Demon Hunter<a class="hash-link" href="#demon-hunter" title="Direct link to heading">​</a></h2><ul><li>[Vengeful Spirit]<!-- -->:<ul><li>Hit rate of all attacks is decreased by (Player Levelx4 -&gt; x3).</li></ul></li></ul><h2 class="anchor anchorWithStickyNavbar_mojV" id="holy-mage">Holy Mage<a class="hash-link" href="#holy-mage" title="Direct link to heading">​</a></h2><ul><li>Healing:<ul><li>Cool time: 30s -&gt; 60s</li></ul></li><li>Heaven Song:<ul><li>Attack range: 6 -&gt; 4</li><li>Cool time: 20s -&gt; 30s</li></ul></li><li>Mana Shield:<ul><li>Cool time: 30s -&gt; 60s</li></ul></li></ul><h2 class="anchor anchorWithStickyNavbar_mojV" id="blue-mage">Blue Mage<a class="hash-link" href="#blue-mage" title="Direct link to heading">​</a></h2><ul><li>Freezing Blast:<ul><li>Casting time: 0.8s -&gt; 0.4s</li></ul></li><li>Ice Chain:<ul><li>Cool time: 45s -&gt; 20s</li><li>There is a 70% -&gt; 30% chance of causing <!-- -->[Freeze]<!-- -->.</li></ul></li><li>Frozen Shield:<ul><li>[NEW]<!-- --> There is a 100% chance of causing <!-- -->[Forgotten Knowledge]<!-- -->.  // only in Fernon raid</li></ul></li><li>Glacier:<ul><li>[NEW]<!-- --> Summons 2x <!-- -->[Snowball Minion]<!-- -->.</li></ul></li><li>Blizzard:<ul><li>Cool time: 90s -&gt; 40s</li><li>There is a 80% -&gt; 60% chance of causing <!-- -->[Deadly Blackout]<!-- -->.</li></ul></li><li>[Shivering Frost]<!-- -->:<ul><li>Level: 1 -&gt; 4</li><li>[NEW]<!-- --> Water resistence is decreased by 15.</li></ul></li><li>[NEW]<!-- --> Forgotten Knowledge:<ul><li>5Lv. Positive Magic Effect</li><li>Duration: 180s</li><li>Reduces enemy's water resistance by 20.</li><li>Increses damage dealt with a probability of 10% by 10%.</li><li>Resists forced movement with a probability of 50%.</li></ul></li><li>Snowball Minion:<ul><li>The damage causes HP to decrease by 25%.</li><li>There is a 2% chance of causing <!-- -->[Cold]<!-- -->.</li><li>Undebuffable, decays in 40 seconds.</li></ul></li></ul><h2 class="anchor anchorWithStickyNavbar_mojV" id="volcano">Volcano<a class="hash-link" href="#volcano" title="Direct link to heading">​</a></h2><ul><li>[Magma Plating]<!-- -->:<ul><li>[REMOVE]<!-- --> Defense against 7000 critical damage (up to 3 times).</li><li>[NEW]<!-- --> Defense against 7000 critical damage.  // now working</li></ul></li></ul><h2 class="anchor anchorWithStickyNavbar_mojV" id="crusader">Crusader<a class="hash-link" href="#crusader" title="Direct link to heading">​</a></h2><ul><li>[Shining Effect]<!-- -->:<ul><li>Every 4 -&gt; 6 seconds: 6% HP is recovered.</li></ul></li><li>Growth Shield:<ul><li>Cool time: 30s -&gt; 60s</li></ul></li></ul><h2 class="anchor anchorWithStickyNavbar_mojV" id="gladiator">Gladiator<a class="hash-link" href="#gladiator" title="Direct link to heading">​</a></h2><ul><li>[Enourmously Shaky Status]<!-- -->:<ul><li>Buff level: 3 -&gt; 5</li></ul></li><li>[Shaky Status]<!-- -->:<ul><li>Buff level: 2 -&gt; 4</li></ul></li><li>Double Blow:<ul><li>There is a 10% -&gt; 20% chance of causing <!-- -->[Knockdown]<!-- -->.</li></ul></li></ul><h2 class="anchor anchorWithStickyNavbar_mojV" id="battle-monk">Battle Monk<a class="hash-link" href="#battle-monk" title="Direct link to heading">​</a></h2><ul><li>Noble Gesture and Spirit of Sacrifice will no longer reset each other's durations.</li><li>Noble Gesture won't be castable when target is enemy.</li><li>[Spiritual Strength]<!-- -->:<ul><li>Hit rate of all attacks is increased by (Player Levelx4 -&gt; x3).</li></ul></li><li>[REMOVE]<!-- --> Reflects up to (Player Levelx4) received damage but does not block attack.</li></ul><h2 class="anchor anchorWithStickyNavbar_mojV" id="renegade">Renegade<a class="hash-link" href="#renegade" title="Direct link to heading">​</a></h2><ul><li>[Ignition]<!-- -->:<ul><li>Hit rate of all attacks is increased by (Player Levelx2 -&gt; x1).</li></ul></li></ul><h2 class="anchor anchorWithStickyNavbar_mojV" id="pyjama">Pyjama<a class="hash-link" href="#pyjama" title="Direct link to heading">​</a></h2><ul><li>Pillow Fight:<ul><li>[NEW]<!-- --> There is a 20% chance of causing <!-- -->[Sleep]<!-- -->.</li></ul></li></ul>]]></content>
        <author>
            <name>Zeref</name>
        </author>
        <category label="changelog" term="changelog"/>
        <category label="act6" term="act6"/>
        <category label="balance" term="balance"/>
    </entry>
    <entry>
        <title type="html"><![CDATA[Act 6 Changelog - 21/01/2022]]></title>
        <id>2022-01-21-changelog</id>
        <link href="https://wiki.olympusgg.com/changelogs/2022-01-21-changelog"/>
        <updated>2022-01-21T00:00:00.000Z</updated>
        <summary type="html"><![CDATA[21/01/2022 - 17:00]]></summary>
        <content type="html"><![CDATA[<blockquote><p>21/01/2022 - 17:00<br>
<!-- -->Server Version: 1.119.0<br>
<!-- -->Client Version: 1.34.0</p></blockquote><h1>Act6</h1><h2 class="anchor anchorWithStickyNavbar_mojV" id="general">General<a class="hash-link" href="#general" title="Direct link to heading">​</a></h2><ul><li>Doubled mobs' normal level exp to make farming to Lv.99 faster.</li><li>Increased raid and map bosses' of A6.1 level from 93 to 99, increased raid bosses' HP by 50%.</li><li>Removed mob-specific drops from raid mobs.</li><li>Decreased the range of some mobs: Lazekiel, Esther, Rement.</li><li>Removed or replaced stuns from most mobs of both Mystic Heaven and Hellord.</li><li>Changed respawn timer of all A6.1 mobs to 3m, except for minibosses.</li><li>Removed Rement's skill where it would dash and gain "Morale Increase".</li><li>Removed Hellord's "Hell Knight" map boss, relocated "Shadow Knight Deront" to Hell's Gate 4.</li><li>Decreased Bacoom's chance of causing <!-- -->[Blackout]<!-- --> from 10% to 5%.</li><li>Increased Mystic Heaven mobs' levels.</li><li>Replaced Mystic Heaven's "Mysticaron"s with "Lazekiel", and "Mystic Knight"s with "Sentinel".</li><li>Removed "Holy Weapon" buff from Lazekiel's skill.</li><li>Readjusted Mystic Heaven mobs' base stats, mainly with nerfs to their defense.</li><li>Reworked passive skill books' levels and their obtaining methods: see <a href="/guides/features/act-6-passives">Passive Book Guide</a></li><li>All A6.1 accessories (Zenas' and Erenia's Ring, Necklace, Bracelet) now have 3 slots of Cellon (Level 9).</li><li>All A6 fairies have 80% attribute upon crafting, and they do not level up.</li><li>Phenomenal equipment will only roll PvP and Perfect shells.</li><li>Phenomenal equipment will have an additional normal A option in armours, and an additional normal B option in weapons.</li></ul><h2 class="anchor anchorWithStickyNavbar_mojV" id="equipment-changes">Equipment Changes<a class="hash-link" href="#equipment-changes" title="Direct link to heading">​</a></h2><h3 class="anchor anchorWithStickyNavbar_mojV" id="bows">Bows<a class="hash-link" href="#bows" title="Direct link to heading">​</a></h3><ul><li>Sealed Heavenly Bow:<ul><li>Reduces the enemy's elemental resistances by 20 -&gt; 19.</li></ul></li><li>Sealed Hellord Bow:<ul><li>Reduces the enemy's elemental resistances by 20 -&gt; 19.</li></ul></li></ul><h3 class="anchor anchorWithStickyNavbar_mojV" id="crossbows">Crossbows<a class="hash-link" href="#crossbows" title="Direct link to heading">​</a></h3><ul><li>Sealed Heavenly Crossbow:<ul><li>[REMOVE]<!-- --> All attacks are increased by 190.</li><li>[REMOVE]<!-- --> All element energies are increased by 12.</li><li>[NEW]<!-- --> Increases damage with a probability of 10% by 35%.</li></ul></li><li>Sealed Hellord Crossbow:<ul><li>[REMOVE]<!-- --> All attacks are increased by 190.</li><li>[REMOVE]<!-- --> All element energies are increased by 12.</li><li>[NEW]<!-- --> Increases damage with a probability of 10% by 35%.</li></ul></li></ul><h3 class="anchor anchorWithStickyNavbar_mojV" id="daggers">Daggers<a class="hash-link" href="#daggers" title="Direct link to heading">​</a></h3><ul><li>Sealed Heavenly Dagger:<ul><li>[REMOVE]<!-- --> All element energies are increased by 10.</li><li>Reduces the enemy's elemental resistances by 10 -&gt; 12.</li></ul></li><li>Sealed Hellord Dagger:<ul><li>[REMOVE]<!-- --> All element energies are increased by 10.</li><li>Reduces the enemy's elemental resistances by 10 -&gt; 12.</li></ul></li></ul><h3 class="anchor anchorWithStickyNavbar_mojV" id="spell-guns">Spell Guns<a class="hash-link" href="#spell-guns" title="Direct link to heading">​</a></h3><ul><li>Sealed Heavenly Spell Gun:<ul><li>Increases damage with a probability of 25% by 30% -&gt; 50%.</li><li>Reduces the enemy's elemental resistances by 10 -&gt; 12.</li></ul></li><li>Sealed Hellord Spell Gun:<ul><li>Increases damage with a probability of 25% by 30% -&gt; 50%.</li><li>Reduces the enemy's elemental resistances by 10 -&gt; 12.</li></ul></li></ul><h3 class="anchor anchorWithStickyNavbar_mojV" id="resistances">Resistances<a class="hash-link" href="#resistances" title="Direct link to heading">​</a></h3><ul><li>Sealed Heavenly Gloves:<ul><li>Level: 20c -&gt; 30c</li><li>Melee/Ranged/Magic Defense: 72 -&gt; 125</li><li>Dodge: 10 -&gt; 0</li><li>[REMOVE]<!-- --> Dodge is increased by 90.</li><li>[NEW]<!-- --> All elemental energies are increased by 150.</li></ul></li><li>Sealed Heavenly Shoes:<ul><li>Level: 28c -&gt; 30c</li><li>Melee/Ranged/Magic Defense: 10 -&gt; 125</li><li>Dodge: 10 -&gt; 125</li><li>[REMOVE]<!-- --> Dodge is increased by 90.</li><li>[REMOVE]<!-- --> Movement speed is increased by 1.</li><li>[NEW]<!-- --> All elemental energies are increased by 150.	</li></ul></li><li>Sealed Hellord Gloves:<ul><li>Level: 25c -&gt; 30c</li><li>Melee/Ranged/Magic Defense: 77 -&gt; 125</li><li>[REMOVE]<!-- --> All defense powers are increased by 45.</li><li>[NEW]<!-- --> All elemental energies are increased by 150.</li></ul></li><li>Sealed Hellord Shoes:<ul><li>Level: 28c -&gt; 30c</li><li>Melee/Ranged/Magic Defense: 15 -&gt; 125</li><li>Dodge: 0 -&gt; 125</li><li>[REMOVE]<!-- --> All defense powers are increased by 45.</li><li>[REMOVE]<!-- --> Movement speed is increased by 1.</li><li>[NEW]<!-- --> All elemental energies are increased by 150.</li></ul></li><li>[NEW]<!-- --> Damned Gloves:<ul><li>Level: 30c</li><li>9% Fire / 7% Water / 7% Light / 9% Shadow</li><li>75 Melee defense / 75 Ranged defense / 75 Magic Defense</li><li>All elemental energies are increased by 100.</li></ul></li><li>[NEW]<!-- --> Sacred Shoes:<ul><li>Level: 30c</li><li>7% Fire / 9% Water / 9% Light / 7% Shadow</li><li>75 Melee defense / 75 Ranged defense / 75 Magic Defense / 75 Dodge</li><li>All elemental energies are increased by 100.</li></ul></li></ul><h3 class="anchor anchorWithStickyNavbar_mojV" id="others">Others<a class="hash-link" href="#others" title="Direct link to heading">​</a></h3><ul><li>Zenas' Divine Ring:<ul><li>Level: 50c -&gt; 30c</li><li>[NEW]<!-- --> There is a 2% chance of causing <!-- -->[Goddess' Favour]<!-- -->.</li><li>[NEW][Goddess' Favour]<!-- -->:<ul><li>Positive Effect (5 Level)</li></ul></li><li>Duration: 4s<div class="codeBlockContainer_I0IT theme-code-block"><div class="codeBlockContent_wNvx"><pre tabindex="0" class="prism-code language-text codeBlock_jd64 thin-scrollbar" style="color:#F8F8F2;background-color:#282A36"><code class="codeBlockLines_mRuA"><span class="token-line" style="color:#F8F8F2"><span class="token plain">- There is a 100% chance that damage from all attacks is reduced by 100%.</span><br></span></code></pre><button type="button" aria-label="Copy code to clipboard" class="copyButton_wuS7 clean-btn">Copy</button></div></div></li><li>Up to level 99 there is a 100% chance of never getting a bad effect.<div class="codeBlockContainer_I0IT theme-code-block"><div class="codeBlockContent_wNvx"><pre tabindex="0" class="prism-code language-text codeBlock_jd64 thin-scrollbar" style="color:#F8F8F2;background-color:#282A36"><code class="codeBlockLines_mRuA"><span class="token-line" style="color:#F8F8F2"><span class="token plain">- Every 2 seconds: Restores (Player Level x 20) HP.</span><br></span></code></pre><button type="button" aria-label="Copy code to clipboard" class="copyButton_wuS7 clean-btn">Copy</button></div></div></li></ul></li><li>Erenia's Crafted Horn:<ul><li>Up to level 4 there is a 15% -&gt; 10% chance of never getting a bad effect.</li></ul></li><li>Zenas Fairy:<ul><li>[REMOVE]<!-- --> Defence power in PvP is increased by 2%.</li><li>[REMOVE]<!-- --> Element is increased by 5.</li><li>[NEW]<!-- --> Increases damage against Demon by 5%.</li><li>[NEW]<!-- --> Reduces the enemy's x resistance by 3.</li></ul></li><li>Erenia Fairy:<ul><li>[REMOVE]<!-- --> Defence power in PvP is increased by 2%.</li><li>[REMOVE]<!-- --> Element is increased by 5.</li><li>[NEW]<!-- --> Increases damage against Angel by 5%.</li><li>[NEW]<!-- --> Reduces the enemy's x resistance by 3.</li></ul></li><li>Sealed Heavenly Helmet/Leather Hat/Headband:<ul><li>Water resistance is increased by 3 -&gt; 10.</li><li>Light resistance is increased by 3 -&gt; 10.</li></ul></li><li>Sealed Hellord Helmet/Leather Hat/Headband:<ul><li>Fire resistance is increased by 3 -&gt; 10.</li><li>Shadow resistance is increased by 3 -&gt; 10.</li></ul></li><li>Guardian Lucifer:<ul><li>Resistances: 7/8/15/2 -&gt; 10/20/20/10</li><li>Speed: +1 -&gt; +3</li></ul></li><li>Archdaemon Amon:<ul><li>Resistances: 12/4/3/16 -&gt; 20/10/10/20</li><li>Speed: +1 -&gt; +3</li></ul></li></ul><h2 class="anchor anchorWithStickyNavbar_mojV" id="removed-items">Removed Items<a class="hash-link" href="#removed-items" title="Direct link to heading">​</a></h2><p>Following items have been removed from game:</p><ul><li>Relic of the First Tribes</li><li>Intact Relic of the First Tribes</li><li>Unstable Energy</li><li>Unknown Sanctuary</li><li>Damaged Orichalcum</li><li>Intact Orichalcum</li><li>Silver Thread</li><li>Golden Thread</li><li>Silk</li><li>Floatstone</li><li>Bacoom Tail</li><li>Soul of Innocence</li><li>Unidentified Metal</li></ul><h2 class="anchor anchorWithStickyNavbar_mojV" id="psp">PSP<a class="hash-link" href="#psp" title="Direct link to heading">​</a></h2><h3 class="anchor anchorWithStickyNavbar_mojV" id="archangel-lucifer">Archangel Lucifer<a class="hash-link" href="#archangel-lucifer" title="Direct link to heading">​</a></h3><ul><li>Mark of Light:<ul><li>There is a 6% -&gt; 20% of causing <!-- -->[Mark of Light]<!-- -->.</li></ul></li><li>[Light of Judgement (S)]<!-- -->:<ul><li>Level: 3 -&gt; 5</li><li>Duration: 18s -&gt; 10s</li></ul></li><li>[Mark of Light (S)]<!-- -->:<ul><li>Level: 3 -&gt; 5</li><li>Duration: 5s -&gt; 10s</li><li>Movement speed is decreased by 4 -&gt; 2.</li></ul></li><li>[Name of God]<!-- -->:  // (F) to (S)<ul><li>Duration: 20/18/16/14/12/10/8 -&gt; 6/7/8/9/10/11/12</li><li>[REMOVE]<!-- --> There is a x% chance that buffs below Lv 4 will be removed.</li><li>[REMOVE]<!-- --> There is a x% chance that no good effects below level 4 can be used.</li><li>[NEW]<!-- --> Light resistence is decreased by 2/4/6/8/9/12/20.</li></ul></li><li>[Name of God (S)]<!-- -->:<ul><li>Level: 4 -&gt; 5</li><li>[NEW]<!-- --> Dodge is decreased by 100.</li></ul></li></ul><h3 class="anchor anchorWithStickyNavbar_mojV" id="overseer-amon">Overseer Amon<a class="hash-link" href="#overseer-amon" title="Direct link to heading">​</a></h3><ul><li>Boiling Over:<ul><li>There is a 20% -&gt; 100% chance of causing <!-- -->[Boiling Over]<!-- -->.</li></ul></li><li>Provocation:<ul><li>Attack range: 7 -&gt; 6</li><li>[REMOVE]<!-- --> There is a 100% chance of causing <!-- -->[Provocation]<!-- -->.</li><li>[NEW]<!-- --> Draws enemies to 1 fields away from you.</li></ul></li><li>[Flame of Hell (S)]<!-- -->:<ul><li>Level: 4 -&gt; 5</li><li>[NEW]<!-- --> Critical damage received is increased by 20%.</li></ul></li><li>[Boiling Over]<!-- -->:  // (F) to (S)<ul><li>Self Buff -&gt; Enemy Debuff</li><li>[REMOVE]<!-- --> Enemy's HP is decreased by x% of the damage I have received.</li><li>[NEW]<!-- --> Shadow resistence is decreased by 2/4/6/8/9/12/20.</li></ul></li><li>[Boiling Over (S)]<!-- -->:<ul><li>Level: 4 -&gt; 5</li></ul></li></ul><h2 class="anchor anchorWithStickyNavbar_mojV" id="sp-balancing">SP Balancing<a class="hash-link" href="#sp-balancing" title="Direct link to heading">​</a></h2><h3 class="anchor anchorWithStickyNavbar_mojV" id="warrior">Warrior<a class="hash-link" href="#warrior" title="Direct link to heading">​</a></h3><ul><li>[Iron Skin]<!-- -->:<ul><li>[REMOVE]<!-- --> All dodges are increased by (Player Levelx2).</li><li>[NEW]<!-- --> All elemental resistances are increased by 10.</li></ul></li><li>Fury:<ul><li>Target: Select One</li><li>There is a 100% chance of causing <!-- -->[Morale increase]<!-- --> -&gt; <!-- -->[Commander's Aura]</li></ul></li><li>[NEW][Commander's Aura]<!-- -->:<ul><li>Positive effect (Level 3)</li><li>Duration: 900s</li><li>Morale stat is increased by (Player Levelx1).</li><li>Every 60 seconds:At a distance of 5, inflict <!-- -->[Morale increase]<!-- --> on our team.</li><li>Every 3600 seconds:At a distance of 5, inflict <!-- -->[Sprint]<!-- --> on our team.</li></ul></li></ul><h3 class="anchor anchorWithStickyNavbar_mojV" id="crusader">Crusader<a class="hash-link" href="#crusader" title="Direct link to heading">​</a></h3><ul><li>Holy Bolt:<ul><li>Cool time: 5.5s -&gt; 7.5s</li></ul></li><li>Holy Bolt(combo):<ul><li>Cool time: 10 -&gt; 7.5s</li></ul></li><li>Shining Effect:<ul><li>Cool time: 80s -&gt; 50s</li></ul></li><li>[Shining Effect]<!-- -->:<ul><li>Duration: 20s -&gt; 15s</li><li>Every 2 -&gt; 4 seconds: 2 -&gt; 6% HP is recovered.</li></ul></li><li>Growth Shield:<ul><li>Casting time: 0.9s -&gt; 0s</li><li>[NEW]<!-- --> There is a 100% chance of causing <!-- -->[Growth Shield]<!-- -->.</li></ul></li><li>[NEW][Growth Shield]<!-- -->: --disapear on movement<ul><li>Positive effect (Level 10)</li><li>Duration: 60s</li><li>Defence is increased by 100%.</li></ul></li><li>[Holy Shield]<!-- -->: -- don't dispear on movement<ul><li>Duration 30s -&gt; 10s</li><li>[REMOVE]<!-- --> All defence powers are increased by (Player Levelx6).</li><li>[ADD]<!-- --> Never receive critical hits.</li></ul></li></ul><h3 class="anchor anchorWithStickyNavbar_mojV" id="berserker">Berserker<a class="hash-link" href="#berserker" title="Direct link to heading">​</a></h3><ul><li>Life and Death:<ul><li>Cool time: 60s -&gt; 40s</li></ul></li><li>[Life and Death]<!-- -->:<ul><li>Duration: 10s -&gt; 15s</li><li>Side effect: after 2.0 -&gt; 0.1 seconds</li><li>Every 2 seconds:HP is reduced by 3 -&gt; 2%.</li></ul></li></ul><h3 class="anchor anchorWithStickyNavbar_mojV" id="gladiator">Gladiator<a class="hash-link" href="#gladiator" title="Direct link to heading">​</a></h3><ul><li>Hunting Horn:<ul><li>[REMOVE]<!-- --> Push your opponent back 1 field.</li></ul></li></ul><h3 class="anchor anchorWithStickyNavbar_mojV" id="death-reaper">Death Reaper<a class="hash-link" href="#death-reaper" title="Direct link to heading">​</a></h3><ul><li>Spirit Splitter:<ul><li>[REMOVE]<!-- --> Hit chance is increased to 100% if it's less.</li></ul></li></ul><h3 class="anchor anchorWithStickyNavbar_mojV" id="assassin">Assassin<a class="hash-link" href="#assassin" title="Direct link to heading">​</a></h3><ul><li>Critical Hit:<ul><li>Cool time: 60s -&gt; 25s</li></ul></li><li>[Sinister Shadow]<ul><li>Duration: 10s -&gt; 7s</li></ul></li><li>[Mental Poison]<!-- -->:<ul><li>Duration: 120s -&gt; 20s</li><li>[NEW]<!-- --> Increases all MP usages by 30%.</li></ul></li><li>[Hideout]<!-- -->:<ul><li>[NEW]<!-- --> Chance of inflicting critical hits is increased by 10%.</li></ul></li><li>Bomb:<ul><li>Cool time: 90s -&gt; 60s</li></ul></li></ul><h3 class="anchor anchorWithStickyNavbar_mojV" id="destroyer">Destroyer<a class="hash-link" href="#destroyer" title="Direct link to heading">​</a></h3><ul><li>Burst Shot:<ul><li>[NEW]<!-- --> There is a 80% chance of causing <!-- -->[Penetrated Armour]<!-- -->.</li></ul></li><li>[NEW][Penetrated Armour]<!-- -->:<ul><li>Negative effect (Level 3)</li><li>Duration: 15s</li><li>Defence level is decreased by 2.</li><li>All defence powers are decreased by (Player Levelx3).</li></ul></li><li>Miraculous Healing -&gt; Overtrained Body<ul><li>[REMOVE]<!-- --> There is a 100% probability to remove bad effects of level 4 or lower.</li></ul></li><li>[Miracle Cure]<!-- --> -&gt; <!-- -->[Overtrained Body]<!-- -->:<ul><li>[NEW]<!-- --> Attack level is increased by 2.</li><li>[NEW]<!-- --> Defense level is increased by 2.</li></ul></li><li>Boom Shot:<ul><li>Cool time: 35s -&gt; 21s</li></ul></li><li>Fire Mine:<ul><li>Cool time: 60s -&gt; 40s</li></ul></li><li>Hell Drop:<ul><li>Cool time: 120s -&gt; 90s</li></ul></li><li>Bomber (monster)<ul><li>[REMOVE]<!-- --> There is a 80% chance of causing <!-- -->[Slowed]<!-- -->.</li><li>[NEW]<!-- --> There is a 100% chance of causing <!-- -->[Severe Visual Impairment]<!-- -->.</li></ul></li><li>[NEW][Severe Visual Impairment]<!-- -->:<ul><li>Level 6 Negative effect</li><li>Duration: 10s</li><li>Hit rate of all attacks is decreased by 150.</li></ul></li><li>Fire mine (monster)<ul><li>[REMOVE]<!-- --> There is a 80% chance of causing <!-- -->[Slowed]<!-- -->.</li><li>[NEW]<!-- --> There is a 80% chance of causing <!-- -->[Cut and Run]<!-- -->.</li></ul></li></ul><h3 class="anchor anchorWithStickyNavbar_mojV" id="wild-keeper">Wild Keeper<a class="hash-link" href="#wild-keeper" title="Direct link to heading">​</a></h3><ul><li>Snake Rush:<ul><li>There is a 100 -&gt; 30% chance of causing {Snake Rush}.</li></ul></li><li>Eagle Spirit:<ul><li>Cool time: 30s -&gt; 60s</li></ul></li><li>[Eagle Spirit]<!-- -->:<ul><li>Duration: 900s -&gt; 180s</li></ul></li></ul><h3 class="anchor anchorWithStickyNavbar_mojV" id="scout">Scout<a class="hash-link" href="#scout" title="Direct link to heading">​</a></h3><ul><li>Mobile Trap:<ul><li>Range: 8 cell -&gt; 6 cell</li><li>Cool time: 12s -&gt; 18s</li></ul></li><li>[Eagle Eye]<!-- -->:<ul><li>[REMOVE]<!-- --> Hit rate of ranged attack is increased by (Player Levelx3).</li></ul></li><li>Rotating Arrow - Level 1:<ul><li>[REMOVE]<!-- --> Chance of inflicting critical hits is increased by 10%.</li></ul></li></ul><h3 class="anchor anchorWithStickyNavbar_mojV" id="holy-mage">Holy Mage<a class="hash-link" href="#holy-mage" title="Direct link to heading">​</a></h3><ul><li>[Enchanted Weapon]<!-- -->:<ul><li>Duration: 10s -&gt; 15s</li></ul></li><li>[Enchanted Armor]<!-- -->:<ul><li>Duration: 10s -&gt; 15s</li></ul></li></ul><h3 class="anchor anchorWithStickyNavbar_mojV" id="dark-gunner">Dark Gunner<a class="hash-link" href="#dark-gunner" title="Direct link to heading">​</a></h3><ul><li>[Evil Potion]<!-- -->:<ul><li>There is a 80 -&gt; 100% chance that buffs below Lv. 4 will be removed.</li></ul></li></ul><h3 class="anchor anchorWithStickyNavbar_mojV" id="volcano">Volcano<a class="hash-link" href="#volcano" title="Direct link to heading">​</a></h3><ul><li>[Lava Swamp]<!-- -->:<ul><li>[REMOVE]<!-- --> Fire element is decreased by 15.</li><li>[ADD]<!-- --> The water element is nullified.</li></ul></li></ul><h3 class="anchor anchorWithStickyNavbar_mojV" id="tide-lord">Tide Lord<a class="hash-link" href="#tide-lord" title="Direct link to heading">​</a></h3><ul><li>Lightning Strike:<ul><li>Cool time: 30s -&gt; 40s</li></ul></li><li>Double Lightning:<ul><li>Cool time: 30s -&gt; 40s</li></ul></li><li>Lightning Storm:<ul><li>Cool time: 60s -&gt; 40s</li></ul></li></ul><h3 class="anchor anchorWithStickyNavbar_mojV" id="seer">Seer<a class="hash-link" href="#seer" title="Direct link to heading">​</a></h3><ul><li>Cursed Hands:<ul><li>There is a 40 -&gt; 80% chance of causing <!-- -->[Cursed Hands]<!-- -->.</li></ul></li><li>Blade Changer:<ul><li>Target: Around enemy in 1 -&gt; 2 cell</li></ul></li><li>Blade I:<ul><li>Target: Around enemy in 1 -&gt; 2 cell</li></ul></li><li>Blade II:<ul><li>Target: Around enemy in 1 -&gt; 2 cell</li></ul></li><li>Time Loss<ul><li>Target: Select Area -&gt; Select enemy</li><li>Cool time: 35s -&gt; 50s</li></ul></li></ul><h3 class="anchor anchorWithStickyNavbar_mojV" id="archmage">Archmage<a class="hash-link" href="#archmage" title="Direct link to heading">​</a></h3><ul><li>[Illuminating Powder]<!-- -->:<ul><li>[REMOVE]<!-- --> Light element is decreased by 10.</li><li>[NEW]<!-- --> Light resistance is decreased by 10.</li></ul></li><li>[Spellbook Scholar]<!-- -->:<ul><li>Non elemental damage received is decreased by 25 -&gt; 20%.</li><li>Heal 25 -&gt; 15% of inflicted damage by reducing MP.</li></ul></li><li>Mass Teleport:<ul><li>Target: Around Friends in 5 cell -&gt; self</li></ul></li><li>[Mass Teleport]<!-- -->:<ul><li>[NEW]<!-- --> Mana for using magic skills is increased by 30%.</li></ul></li></ul>]]></content>
        <author>
            <name>Zeref</name>
        </author>
        <author>
            <name>Gigoto</name>
        </author>
        <category label="changelog" term="changelog"/>
        <category label="act6" term="act6"/>
        <category label="balance" term="balance"/>
    </entry>
    <entry>
        <title type="html"><![CDATA[Changelog - 14/01/2022]]></title>
        <id>2022-01-14-changelog</id>
        <link href="https://wiki.olympusgg.com/changelogs/2022-01-14-changelog"/>
        <updated>2022-01-14T00:00:00.000Z</updated>
        <summary type="html"><![CDATA[14/01/2022 - 23:15]]></summary>
        <content type="html"><![CDATA[<blockquote><p>14/01/2022 - 23:15<br>
<!-- -->Server Version: 1.111.0<br>
<!-- -->Client Version: 1.30.0</p></blockquote><h1>General Changes</h1><ul><li>Rainbow Battle will now have 2v2 matchups when there aren't enough people for 3v3.</li><li>Rainbow Battles' duration have been reduced from 10 to 7 minutes.</li><li>Disable Jajamaru's "Create" skill in A4 dungeons, and invisibility skills in Instant Combat.</li><li>Christmas weapon skins' bonus was changed, and items are unlisted from NosBazaar:<ul><li>Damage dealt in PvP is increased by 2% -&gt; 5%.</li></ul></li><li>Divided damage in Frozen Crown by 3</li></ul><h1>Bug Fixes</h1><ul><li>Fixed Vengeful Spirit Pendulum applying hit before dash instead of after.</li><li>Fixed being able to buff frozen enemies in Rainbow Battle.</li><li>Fixed being able to buff jumping Lord Draco.</li><li>Fixed swordsman christmas skin</li><li>Fixed Glacerus &amp; Draco boxes icons</li><li>Fixed a bug where you would get stuck when attacking Lord Draco when he was jumping</li></ul>]]></content>
        <category label="changelog" term="changelog"/>
    </entry>
    <entry>
        <title type="html"><![CDATA[Changelog - 09/01/2022]]></title>
        <id>2022-01-09-changelog</id>
        <link href="https://wiki.olympusgg.com/changelogs/2022-01-09-changelog"/>
        <updated>2022-01-09T00:00:00.000Z</updated>
        <summary type="html"><![CDATA[09/01/2022 - 21:00]]></summary>
        <content type="html"><![CDATA[<blockquote><p>09/01/2022 - 21:00<br>
<!-- -->Server Version: 1.102.0<br>
<!-- -->Client Version: 1.27.0</p></blockquote><h1>General</h1><ul><li>Added an option to show/hide monster HP/MP.</li><li>Added new recipes for potions.</li><li>Unlisted following items from NosBazaar: Red Fruit, Blue Herb, Sugar Beet, Large Health Potion, Large Mana Potion, Large Recovery Potion.</li></ul><h1>Balances</h1><ul><li>Oracle's Headband:<ul><li>There is a 8% -&gt; 4% chance that damage from magic attacks is reduced by 4%.</li></ul></li><li>Old Gentleman's Hat:<ul><li>There is a 8% -&gt; 4% chance that damage from magic attacks is reduced by 4%.</li><li>There is a 8% -&gt; 4% chance that damage from ranged attacks is reduced by 4%.</li><li>[NEW]<!-- --> There is a 4% chance that damage from melee attacks is reduced by 4%.</li></ul></li><li>Reduced the res drain for 90/92/95 bows' by 1, and increased swords'.</li></ul><h1>Bug fixes</h1><ul><li>Finally fixed the session stuck on channels issue.</li><li>Fixed wrong grouping in achievements.</li><li>Fixed old descriptions of wing items.</li><li>Blackscreen that would occur for some people</li><li>Illusionist in shop was not working (fixed now) </li></ul><h1>Shop Rotation Week 7</h1><h4 class="anchor anchorWithStickyNavbar_mojV" id="pets">Pets<a class="hash-link" href="#pets" title="Direct link to heading">​</a></h4><ul><li><strong>[REMOVE]</strong> Indian Bushi Random Box</li><li><strong>[NEW]</strong> Ninja Bushi Random Box</li></ul><h4 class="anchor anchorWithStickyNavbar_mojV" id="psp">PSP<a class="hash-link" href="#psp" title="Direct link to heading">​</a></h4><ul><li><strong>[REMOVE]</strong> Barni PSP Random Box</li><li><strong>[REMOVE]</strong> Freya PSP Random Box</li><li><strong>[REMOVE]</strong> Aegir PSP Random Box</li><li><strong>[NEW]</strong> Foxy PSP Random Box:<ul><li><code>[Piercing Howl]</code>:  // F to S<ul><li>The cooldown time for reusing magic attacks is reduced by 10/15/20/25/30/35/40 -&gt; 5/8/11/14/17/20/25%.</li></ul></li><li><code>[Piercing Howl (S)]</code>:<ul><li>Duration: 28s -&gt; 30s</li></ul></li><li><code>[Fall for the Charms (S)]</code>:<ul><li>Level 4 -&gt; 5</li></ul></li></ul></li></ul><h4 class="anchor anchorWithStickyNavbar_mojV" id="costume">Costume<a class="hash-link" href="#costume" title="Direct link to heading">​</a></h4><ul><li><strong>[REMOVE]</strong> Karate Costume Set Random Box</li><li><strong>[NEW]</strong> Illusionist's Costume Set Random Box<ul><li><code>Illusionist's Costume</code>:<ul><li>Movement speed is increased by 1.</li><li>There is a 5% chance that damage from magic attacks is reduced by 100%.</li></ul></li><li><code>Illusionist's Top Hat</code>:<ul><li>There is a 3% chance of causing <!-- -->[Trickery]<!-- -->.</li><li>Damage dealt is increased by 4%.</li></ul></li></ul></li></ul>]]></content>
        <category label="changelog" term="changelog"/>
        <category label="balance" term="balance"/>
        <category label="shop" term="shop"/>
    </entry>
    <entry>
        <title type="html"><![CDATA[Changelog - 07/01/2022]]></title>
        <id>2022-01-07-changelog</id>
        <link href="https://wiki.olympusgg.com/changelogs/2022-01-07-changelog"/>
        <updated>2022-01-07T00:00:00.000Z</updated>
        <summary type="html"><![CDATA[07/01/2022 - 12:15]]></summary>
        <content type="html"><![CDATA[<blockquote><p>07/01/2022 - 12:15<br>
<!-- -->Server Version: 1.99.0<br>
<!-- -->Client Version: 1.25.0</p></blockquote><h1>Technical changes</h1><ul><li>More and more things to prepare act6.1 release</li><li>Some technical changes needed for SP balance testing</li></ul><h1>Bugfixes</h1><ul><li>Monsters are not applying debuffs on miss anymore</li><li>Some bugs &amp; potential exploits with some specific achievements (thanks to the ones who reported it to us)</li><li>Act4 Berios debuff</li></ul><h1>Changes</h1><ul><li>Added channels on speakers without an item linked in it</li><li>Improved some calculation of PvP shell defense for damages</li></ul>]]></content>
        <category label="changelog" term="changelog"/>
    </entry>
    <entry>
        <title type="html"><![CDATA[Changelog - 02/01/2022]]></title>
        <id>2022-01-02-changelog</id>
        <link href="https://wiki.olympusgg.com/changelogs/2022-01-02-changelog"/>
        <updated>2022-01-02T00:00:00.000Z</updated>
        <summary type="html"><![CDATA[02/01/2022 - 21:30]]></summary>
        <content type="html"><![CDATA[<blockquote><p>02/01/2022 - 21:30<br>
<!-- -->Server Version: 1.95.0<br>
<!-- -->Client Version: 1.23.0</p></blockquote><h1>Technical changes</h1><ul><li>Deployed the HP/MP preview feature on monsters, pets &amp; NPCs</li><li>Updated some third party dependencies to keep ourselves up to date</li><li>Added some internal tooling to help GMs</li></ul><h1>Bug Fixes</h1><ul><li>Family faction different for some members issue should now be fixed.</li><li>Fixed famiy logs for act4 dungeons.</li><li>Fixed Broom Service 2 achievement.</li><li>Fixed calculation error regarding "Increased Overall Defense".</li><li>Added back the minimum damage in PvE that was removed unintentionally.</li><li>Ice Flower Oil can now be used while on the mount.</li></ul><h1>Changes</h1><ul><li>[Scent of the Curse (S)]<!-- -->:<ul><li>[REMOVE]<!-- --> Non-elemental magic received damage is increased by 20%.</li><li>[NEW]<!-- --> There is a 100% chance that damage from magic attacks is increased by 20%.</li></ul></li><li>Replaced Partner Specialists in raid/random boxes with "Sealed" versions that can be exchanged before using them.</li><li>Replaced Kertos' Shadows debuff <!-- -->[Fatal Blackout]<!-- --> with <!-- -->[Burn]<!-- -->.</li><li>Removed <!-- -->[Blackout]<!-- --> from the skill of Kertos the Demon Dog.</li><li>Made Rainbow Mandras of Rainbow Battle unable to kill players.</li><li>Reduced damage against race titles' bonus from 15% to 10%. </li></ul><h1>Act4 Dungeons improvements</h1><p>Dark Guardian Eye:</p><ul><li>Movement speed 3 -&gt; 6</li><li>Attack range 10 -&gt; 8</li><li>HP increased</li></ul><p>Dark Hermit:</p><ul><li>Can be provoked</li></ul><p>Crystal Cave Guardian:</p><ul><li>There is a 18% -&gt; 5% chance of causing <!-- -->[Shock]<!-- -->.</li></ul><p>Ocean Guardian:</p><ul><li>Can receive debuff</li></ul><p>Crystal Cave Guard Dog:</p><ul><li>[Guard Dog's Snarl]<!-- -->:<ul><li>Duration: 10s -&gt; 6s</li></ul></li></ul><h1>Shop Rotation Week 6</h1><h4 class="anchor anchorWithStickyNavbar_mojV" id="pets">Pets<a class="hash-link" href="#pets" title="Direct link to heading">​</a></h4><ul><li><strong>[REMOVE]</strong> Viking Bushi Random Box</li><li><strong>[REMOVE]</strong> Rudolph Bushi Random Box</li><li><strong>[NEW]</strong> Indian Bushi Random Box</li><li><code>Indian's Blessing:</code><ul><li>Damage dealt is increased by %5.</li><li>Fire resistance is increased by 10.</li><li>Damage received from critical hits is decreased by 10%.</li></ul></li><li><code>Indian Blood Tie</code>:<ul><li>There is a 100% probability to remove bad effects of level 4 or lower.</li><li>Every 2 seconds: 10% HP is recovered.</li></ul></li></ul><h4 class="anchor anchorWithStickyNavbar_mojV" id="mounts">Mounts<a class="hash-link" href="#mounts" title="Direct link to heading">​</a></h4><ul><li><strong>[REMOVE]</strong> White Unicorn Random Box</li><li><strong>[REMOVE]</strong> Magic Sleigh with Red-nosed Reindeer Random Box</li><li><strong>[NEW]</strong> 'Billy Boneshaker' Bike:<ul><li>Speed: 21</li><li>Bonus Speed: +3 in Act5</li><li>Speed Booster Effect: Teleports you 5 fields forwards.</li><li>Speed Booster Speed: +3, 5s</li></ul></li></ul><h4 class="anchor anchorWithStickyNavbar_mojV" id="wings">Wings<a class="hash-link" href="#wings" title="Direct link to heading">​</a></h4><ul><li><strong>[REMOVE]</strong> Golden Wings Random Box</li><li><strong>[NEW]</strong> Crystal Wings Random Box</li><li><code>Crystal Wings:</code><ul><li>Movement speed is increased by 1.</li><li>Up to level 4 there is a 15% chance of never getting a bad effect.</li></ul></li></ul><h4 class="anchor anchorWithStickyNavbar_mojV" id="costume">Costume<a class="hash-link" href="#costume" title="Direct link to heading">​</a></h4><ul><li><strong>[REMOVE]</strong> Santa Bushi Costume Set Random Box</li></ul>]]></content>
        <category label="changelog" term="changelog"/>
        <category label="balance" term="balance"/>
        <category label="a4" term="a4"/>
        <category label="shop" term="shop"/>
    </entry>
    <entry>
        <title type="html"><![CDATA[Changelog - 27/12/2021]]></title>
        <id>2021-12-27-changelog</id>
        <link href="https://wiki.olympusgg.com/changelogs/2021-12-27-changelog"/>
        <updated>2021-12-27T00:00:00.000Z</updated>
        <summary type="html"><![CDATA[27/12/2021 - 14:30]]></summary>
        <content type="html"><![CDATA[<blockquote><p>27/12/2021 - 14:30<br>
<!-- -->Server Version: 1.91.0<br>
<!-- -->Client Version: 1.18.0</p></blockquote><h1>Fixes</h1><ul><li>Fixed a gold exploit (not a duplication) that allowed a player to get lots of gold. No rollback will be done, this had 0 impact on the economy and the bug user has been banned.</li><li>Added more logging that will help us fixing the walking issue because we can't reproduce it locally.</li></ul>]]></content>
        <category label="changelog" term="changelog"/>
    </entry>
    <entry>
        <title type="html"><![CDATA[Changelog - 25/12/2021]]></title>
        <id>2021-12-25-changelog</id>
        <link href="https://wiki.olympusgg.com/changelogs/2021-12-25-changelog"/>
        <updated>2021-12-25T00:00:00.000Z</updated>
        <summary type="html"><![CDATA[25/12/2021 - 00:30]]></summary>
        <content type="html"><![CDATA[<blockquote><p>25/12/2021 - 00:30<br>
<!-- -->Server Version: 1.89.0<br>
<!-- -->Client Version: 1.18.0</p></blockquote><h1>Fixes</h1><ul><li>Reworded some Bcards (orange text) to avoid confusion on their functionings.</li><li>Fixed a bug where custom buffs were overwriting some others.</li><li>Fixed "Knockdown" getting removed on "Taunt" skill.</li></ul><h1>Christmas Shop Rotation</h1><p>For Christmas, we're putting the regular rotations on hold, meaning this week, shop items won't rotate according to schedule.
Instead, we add Christmas exclusive shop items, for one week only.</p><h1>Vehicle</h1><ul><li>Magic Sleigh with Red-nosed Reindeer:<ul><li>Speed: 22</li><li>Bonus Speed: +3 in Act4</li><li>Speed Booster Speed: +3, 5s</li><li>Speed Booster Effect:<ul><li>Provides a certain chance to trigger <!-- -->[Magic of the Red Nose]<!-- --> when the speed booster effect ends.</li><li>[Magic of the Red Nose]<!-- -->:<ul><li>Positive Effect (3 Level)</li><li>Duration: 30s</li><li>Every 2 seconds: Restores (Player Levelx3) HP.</li></ul></li></ul></li></ul></li></ul><h1>Pet</h1><ul><li>Rudolf Bushi:</li><li>[NEW][Blessing of Christmas]<!-- -->:<ul><li>Damage dealt is increased by 5%.</li><li>Increases fame received by 5%.</li></ul></li></ul><h1>Costume</h1><ul><li><p>Santa Bushtail Costume:</p></li><li><p>Movement speed is increased by 1.</p></li><li><p>Increases fame received by 5%.</p></li><li><p>Santa Bushtail Hat:</p></li><li><p>There is a 3% chance of causing <!-- -->[Shock]<!-- -->.</p></li><li><p>Shadow resistance is increased by 5.</p></li></ul>]]></content>
        <category label="changelog" term="changelog"/>
        <category label="shop" term="shop"/>
    </entry>
    <entry>
        <title type="html"><![CDATA[Changelog - 23/12/2021]]></title>
        <id>2021-12-23-changelog</id>
        <link href="https://wiki.olympusgg.com/changelogs/2021-12-23-changelog"/>
        <updated>2021-12-23T00:00:00.000Z</updated>
        <summary type="html"><![CDATA[23/12/2021 - 16:30]]></summary>
        <content type="html"><![CDATA[<blockquote><p>23/12/2021 - 16:30<br>
<!-- -->Server Version: 1.88.0<br>
<!-- -->Client Version: 1.17.0</p></blockquote><h1>Balance</h1><ul><li>Ancient Scripts III​:<ul><li>[REMOVE]<!-- --> MP is increased by 1% of damage given.</li><li>[NEW]<!-- --> The cooldown time for reusing magic skills is reduced by 10%.</li></ul></li><li>"There is a x% chance that every attack hits." BCard is replaced with "Hit chance is increased to x% if it's less."</li><li>[Magic Light]<!-- -->:<ul><li>[REMOVE]<!-- --> There is a 60% chance that every attack hits.</li><li>[NEW]<!-- --> Hit chance is reduced to 60% if it's more.</li></ul></li><li>[Blinded]<!-- -->:<ul><li>[REMOVE]<!-- --> There is a 30% chance that every attack hits.</li><li>[NEW]<!-- --> Hit chance is reduced to 30% if it's more.</li></ul></li><li>[Smog]<!-- -->:<ul><li>[REMOVE]<!-- --> There is a 50% chance that every attack hits.</li><li>[NEW]<!-- --> Hit chance is reduced to 50% if it's more.</li></ul></li></ul><h1>Fixes</h1><ul><li>Fixed Reignition buff not having "Movement speed is increased by 1."</li><li>Fixed "Mental Poison" of Assassin increasing enemy HP instead of decreasing it.</li></ul><hr><blockquote><p>Launcher Version: 1.15.0</p></blockquote><h1>Fixes</h1><ul><li>Fixed a bug when people would lose their session</li><li>Fixed a bug that would sometime corrupt the downloaded client file on download error</li></ul><h1>UX Improvements</h1><ul><li>More feedback when the server is under maintenance</li></ul>]]></content>
        <category label="changelog" term="changelog"/>
        <category label="balance" term="balance"/>
        <category label="launcher" term="launcher"/>
    </entry>
    <entry>
        <title type="html"><![CDATA[Changelog - 20/12/2021]]></title>
        <id>2021-12-20-changelog</id>
        <link href="https://wiki.olympusgg.com/changelogs/2021-12-20-changelog"/>
        <updated>2021-12-20T00:00:00.000Z</updated>
        <summary type="html"><![CDATA[20/12/2021 - 11:30]]></summary>
        <content type="html"><![CDATA[<blockquote><p>20/12/2021 - 11:30<br>
<!-- -->Server Version: 1.86.0<br>
<!-- -->Client Version: 1.16.0</p></blockquote><h1>Bug Fixes</h1><ul><li>Fixed a bug with mass crafting when crafting too many items at once</li><li>Fixed Renegade's Reignition buff </li></ul><h1>Changes</h1><ul><li>Updated description for Laurena Seal and Laurena's Disguise</li><li>Laurena seal can now be dropped on the ground</li></ul>]]></content>
        <category label="changelog" term="changelog"/>
    </entry>
    <entry>
        <title type="html"><![CDATA[Changelog - 19/12/2021]]></title>
        <id>2021-12-19-changelog</id>
        <link href="https://wiki.olympusgg.com/changelogs/2021-12-19-changelog"/>
        <updated>2021-12-19T00:00:00.000Z</updated>
        <summary type="html"><![CDATA[19/12/2021 - 13:30]]></summary>
        <content type="html"><![CDATA[<blockquote><p>19/12/2021 - 13:30<br>
<!-- -->Server Version: 1.85.0<br>
<!-- -->Client Version: 1.15.0</p></blockquote><h1>Bug Fixes</h1><ul><li>You cannot get transformed into a hamster or a bushtail if you have the "Thorn Bush" debuff</li><li>You cannot get the "Thorn Bush" debuff if you are transformed into a hamster or a bushtail</li><li>Fixed a bug where you would get stuck if you were transformed while sitting</li><li>Fix <!-- -->[Enchanted Armor]<!-- --> increasing critical damage received instead of decreasing it</li></ul><h1>Changes</h1><ul><li>New RBB brackets. They are now <!-- -->[90 - 94]<!-- --> &amp; <!-- -->[95 - 99]</li><li>Laurena reputation has been increased to 6000</li></ul>]]></content>
        <category label="changelog" term="changelog"/>
        <category label="rbb" term="rbb"/>
    </entry>
    <entry>
        <title type="html"><![CDATA[Changelog - 18/12/2021 - Laurena Raid & God's Altar]]></title>
        <id>2021-12-18-changelog</id>
        <link href="https://wiki.olympusgg.com/changelogs/2021-12-18-changelog"/>
        <updated>2021-12-18T00:00:00.000Z</updated>
        <summary type="html"><![CDATA[18/12/2021 - 23:00]]></summary>
        <content type="html"><![CDATA[<blockquote><p>18/12/2021 - 23:00<br>
<!-- -->Server Version: 1.84.0<br>
<!-- -->Client Version: 1.13.0</p></blockquote><h1>Laurena Raid</h1><ul><li>Added Laurena raid.</li><li>You don't need Cleansing Powder in Laurena raid, you can freely join it without worrying about <!-- -->[Morose Mood]<!-- --> debuff.</li><li>Minimum required level is 70, raid team can have up to 15 players.</li><li>Laurena title "Little Witch" might protect you against the debuffs of the witch: Thorn Bush, Scent of the Curse (Bushi), and Scent of the Curse (Rat).</li><li>Laurena drops two hats, Laurena's Witch Hat and Beast's Golden Horn.</li><li>Laurena's Witch Hat:<ul><li>Up to level 4 there is a 10% chance of never getting a bad effect.</li><li>There is a 3% chance of causing <!-- -->[Witch's Blessing]<!-- -->.</li></ul></li><li>Beast's Golden Horn:<ul><li>Up to level 4 there is a 10% chance of never getting a bad effect.</li><li>There is a 3% chance of causing <!-- -->[Magical Reflection]<!-- -->.</li></ul></li><li>Laurena's Gemstone will be used to craft both SP7 and SP8, see <a href="https://wiki.olympusgg.com/guides/sp-guides/sp5-to-sp8" target="_blank" rel="noopener noreferrer">here</a>.</li></ul><h1>Laurena PSP</h1><ul><li>Thorn Bush:<ul><li>Cool time: 15s -&gt; 35s</li><li>There is a 30% -&gt; 100% chance of causing <!-- -->[Thorn Bush]<!-- -->.</li></ul></li><li>Scent of the Curse:<ul><li>There is a 25% -&gt; 100% chance of causing <!-- -->[Scent of the Curse]<!-- -->.</li></ul></li><li>[Pulse of Light (S)]<!-- -->:<ul><li>Level 4 -&gt; 5</li></ul></li><li>[Thorn Bush (S)]<!-- -->:<ul><li>Level 4 -&gt; 5</li><li>Movement speed is decreased by 3 -&gt; 2.</li></ul></li><li>[Scent of the Curse (S)]<!-- -->:<ul><li>Level: 4 -&gt; 5</li><li>[NEW]<!-- --> Magic damage is increased by 20%.</li></ul></li></ul><h1>General</h1><ul><li>Added God's Altar feature, see <a href="https://wiki.olympusgg.com/custom-features/gods-altar" target="_blank" rel="noopener noreferrer">here</a>.</li><li>Shop Rotations - Week 4 is added: More info <a href="https://wiki.olympusgg.com/shop/2021-12-18-rotations-week-4" target="_blank" rel="noopener noreferrer">here</a>.</li><li>Shop Rotation frequency for "Costume" and "Vehicle" is changed from weekly to biweekly.</li><li>Changed the price of Team Stones in Malcolm from 15k to 10k.</li></ul><h1>Balance &amp; Improvements</h1><ul><li>Dungeon mobs' HP is increased five fold.</li><li>Increased the rates of dropping perfection stones in dungeons' first rooms from 3% to 5%.</li><li>Spawned mobs in dungeon boss rooms no longer drop perfection stones.</li><li>Fix soundflower buff not getting removed in PvP.</li></ul><h1>Fixes</h1><ul><li>Fixed "Reflects an opponent's bad effect with a certain likelihood." not blocking debuffs.</li><li>Fixed Glacerus Title</li><li>Fixed miniland structures were removed after relogging</li><li>Fixed the bug where your character would get stuck transformed into a bushi/hamster in Laurena</li></ul><h1>SP Balances</h1><h2 class="anchor anchorWithStickyNavbar_mojV" id="crusader">Crusader<a class="hash-link" href="#crusader" title="Direct link to heading">​</a></h2><ul><li>Shining Effect:<ul><li>Cool time: 5s -&gt; 80s</li><li>Consumption MP: 40 -&gt; 150</li><li>[REMOVE]<!-- --> Restores (Player Levelx25) HP.</li><li>[NEW]<!-- --> Removes all bad effects up to level 2.</li><li>[NEW]<!-- --> There is a 100% chance of causing <!-- -->[Shining Effect]<!-- -->.</li></ul></li><li>[NEW][Shining Effect]<!-- -->:<ul><li>5Lv. Good: Magic Effect</li><li>Duration: 20s</li><li>Every 2 seconds: 2% HP is recovered.</li><li>Up to level 4 there is a 10% chance of never getting a bad effect.</li></ul></li></ul><h2 class="anchor anchorWithStickyNavbar_mojV" id="berserker">Berserker<a class="hash-link" href="#berserker" title="Direct link to heading">​</a></h2><ul><li>[Berserker]<!-- -->:<ul><li>Movement speed is increased by 4 -&gt; 2.</li></ul></li><li>[Life and Death]<!-- -->:<ul><li>Duration: 20s -&gt; 10s</li><li>Every 2 seconds: HP is reduced by (Player Levelx4) -&gt; 3%.</li><li>Shadow element is increased by 500 -&gt; 300.</li><li>[ADD]<!-- --> Movement speed is increased by 2.</li><li>[ADD]<!-- --> Melee attacks are increased by 10%.</li><li>[ADD]<!-- --> Reduce cooldown of skills by 10%.</li></ul></li></ul><h2 class="anchor anchorWithStickyNavbar_mojV" id="battle-monk">Battle Monk<a class="hash-link" href="#battle-monk" title="Direct link to heading">​</a></h2><ul><li>[Spirit of Sacrifice]<!-- -->:<ul><li>Every 4 seconds: Restores (Player Levelx4 -&gt; x2) MP.</li><li>Reflect up to (Player Levelx8 -&gt; x4) received damage but does not block the attack.</li></ul></li><li>Meditation -&gt; Short Meditation:<ul><li>Casting Time: 0.1s -&gt; 0.4s</li><li>[REMOVE]<!-- --> The short meditation has a 100% probability of causing <!-- -->[Spirit of Enlightenment]<!-- -->.</li><li>[REMOVE]<!-- --> The regular meditation has a 100% probability of causing <!-- -->[Spirit of Temperance]<!-- -->.</li><li>[REMOVE]<!-- --> There is a 100% chance of the lengthy meditation causing <!-- -->[Spiritual Strenght]<!-- -->.</li><li>[NEW]<!-- --> There is a 100% chance of causing <!-- -->[Short Meditation]<!-- -->.</li><li>[NEW]<!-- --> There is a 100% chance of causing {Regular Meditation}.</li></ul></li><li>[NEW][Short Meditation]<!-- -->:<ul><li>Duration: 2s</li><li>4Lv. Good: General Effect</li><li>[Spirit of Enlightenment]<!-- --> occurs, in releasing at the probability of 100%.</li><li>Disappears when hit</li></ul></li><li>[NEW][Regular Meditation]<!-- -->:<ul><li>Duration: 2s</li><li>5Lv. Good: General Effect</li><li>[Spirit of Temperance]<!-- --> occurs, in releasing at the probability of 100%.</li><li>Disappears when hit</li></ul></li><li>[NEW][Lengthy Meditation]<!-- -->:<ul><li>Duration: 2s</li><li>6Lv. Good: General Effect</li><li>[Spiritual Strenght]<!-- --> occurs, in releasing at the probability of 100%.</li><li>Disappears when hit</li></ul></li><li>[NEW]<!-- --> {Regular Meditation}:<ul><li>Casting time: 0.4s</li><li>Cool time: 30s</li><li>There is a 100% chance of causing <!-- -->[Regular Meditation]<!-- -->.</li><li>There is a 100% chance of causing {Lengthy Meditation}.</li></ul></li><li>[NEW]<!-- --> {Lengthy Meditation}:<ul><li>Casting time: 0.4s</li><li>Cool time: 30s</li><li>There is a 100% chance of causing <!-- -->[Lengthy Meditation]<!-- -->.</li></ul></li><li>Buddha's Words:<ul><li>Consumption MP: 900 -&gt; 400</li><li>Restores (Player Levelx10 -&gt; x20) HP.</li></ul></li></ul><h2 class="anchor anchorWithStickyNavbar_mojV" id="scout">Scout<a class="hash-link" href="#scout" title="Direct link to heading">​</a></h2><ul><li>Falcon Nosedive:<ul><li>There is a 70% -&gt; 100% chance of causing {Rotation Arrow - Highest Level}.</li></ul></li><li>Mobile Trap:<ul><li>Attack Range: Itself -&gt; 8 cell</li></ul></li><li>[Vital Energy]<!-- -->:<ul><li>Every 2 -&gt; 6 seconds: Restores (Player Levelx2) MP.</li></ul></li><li>[Ambush Raid]<!-- -->:<ul><li>Duration: 7s -&gt; 3s</li></ul></li></ul><h2 class="anchor anchorWithStickyNavbar_mojV" id="red-mage">Red Mage<a class="hash-link" href="#red-mage" title="Direct link to heading">​</a></h2><ul><li>Fire Burst:<ul><li>[NEW]<!-- --> There is a 20% chance of causing <!-- -->[Short Blackout]<!-- -->.</li></ul></li></ul><h2 class="anchor anchorWithStickyNavbar_mojV" id="holy-mage">Holy Mage<a class="hash-link" href="#holy-mage" title="Direct link to heading">​</a></h2><ul><li>Healing:<ul><li>Attack Range: Itself or 6 -&gt; 8 cell</li><li>[NEW]<!-- --> 5% HP is recovered.</li></ul></li><li>Holy Light:<ul><li>Target: Around Enemy in 1 -&gt; 2 cell</li><li>Cool time: 5.5s -&gt; 8s</li><li>There is a 10% -&gt; 15% chance of causing <!-- -->[Magic Light]<!-- -->.</li></ul></li><li>[Mana Shield]<!-- -->:<ul><li>[NEW]<!-- --> MP is increased by 1% of damage given.</li></ul></li><li>Cure All:<ul><li>[NEW]<!-- --> There is a 100% chance of causing <!-- -->[Purified]<!-- -->.</li></ul></li><li>Group Healing:<ul><li>Cool Time: 20s -&gt; 15s</li><li>Target: Around friends in 4 -&gt; 5 cell</li></ul></li><li>Holy Weapon:<ul><li>Casting time: 0.8s -&gt; 0.4s</li><li>Target: Around friends in 4 -&gt; 5 cell</li><li>[NEW]<!-- --> There is a 100% chance of causing <!-- -->[Enchanted Weapon]<!-- -->.</li></ul></li><li>Blessing:<ul><li>Casting time: 0.8s -&gt; 0.4s</li><li>Target: Around friends in 4 -&gt; 5 cell</li><li>[NEW]<!-- --> There is a 100% chance of causing <!-- -->[Enchanted Armor]<!-- -->.</li></ul></li><li>[NEW][Purified]<!-- -->:<ul><li>4Lv. Good: Magic Effect</li><li>Duration: 3s</li><li>Up to level 4 there is a 100% chance of never getting a bad effect.</li></ul></li><li>[NEW][Enchanted Weapon]<!-- -->:<ul><li>3Lv. Good: Magic Effect</li><li>Duration: 10s</li><li>Attack level is increased by 1.</li><li>Damage dealt is increased by 10%.</li></ul></li><li>[NEW][Enchanted Armor]<!-- -->:<ul><li>3Lv. Good: Magic Effect</li><li>Duration: 10s</li><li>Defence level is increased by 1.</li><li>Damage received from critical hits is decreased by 20%.</li></ul></li></ul><h2 class="anchor anchorWithStickyNavbar_mojV" id="blue-mage">Blue Mage<a class="hash-link" href="#blue-mage" title="Direct link to heading">​</a></h2><ul><li>Ice Shard:<ul><li>[NEW]<!-- --> There is a 60% chance of causing <!-- -->[Bleeding]<!-- -->.</li></ul></li></ul><h2 class="anchor anchorWithStickyNavbar_mojV" id="dark-gunner">Dark Gunner:<a class="hash-link" href="#dark-gunner" title="Direct link to heading">​</a></h2><ul><li>Combination Shot:<ul><li>Chance of inflicting critical hits is increased by 10% -&gt; 15%.</li><li>There is a 50% -&gt; 100% chance of causing {Combination Shot}.</li></ul></li><li>{Combination Shot}:<ul><li>Chance of inflicting critical hits is increased by 10% -&gt; 15%.</li></ul></li><li>Magic Blitz:<ul><li>Cool time: 23s -&gt; 16s</li><li>[REMOVE]<!-- --> There is a 15% chance that buffs below Lv. 3 will be removed.</li></ul></li><li>Curse Blitz:<ul><li>Cool time: 34s -&gt; 25s</li><li>[REMOVE]<!-- --> There is a 20% chance that buffs below Lv. 3 will be removed.</li></ul></li><li>Ghost Recharge:<ul><li>[REMOVE]<!-- --> There is a 20% chance that buffs below Lv. 3 will be removed.</li></ul></li><li>Requiem:<ul><li>Cool time: 100s -&gt; 60s</li></ul></li><li>[Ghost Guard]<!-- -->:<ul><li>Movement speed is increased by 4 -&gt; 3.</li><li>Damage is decreased by 30% -&gt; 20%.</li></ul></li></ul><h2 class="anchor anchorWithStickyNavbar_mojV" id="tide-lord">Tide Lord<a class="hash-link" href="#tide-lord" title="Direct link to heading">​</a></h2><ul><li>[Song of Siren]<!-- -->:<ul><li>Duration: 16s -&gt; 8s</li><li>All elemental resistances are increased -&gt; decreased by (Player Level/5) -&gt; 15.</li></ul></li><li>[Song of Siren (PvP)]<!-- -->:<ul><li>Duration: 8s -&gt; 4s</li><li>All elemental resistances are increased -&gt; decreased by (Player Level/5) -&gt; 15.</li></ul></li></ul><h2 class="anchor anchorWithStickyNavbar_mojV" id="death-reaper">Death Reaper<a class="hash-link" href="#death-reaper" title="Direct link to heading">​</a></h2><ul><li>Movement speed +0 -&gt; +2</li><li>Job: 70 -&gt; 80</li><li>Death's Scyhte:<ul><li>[NEW]<!-- --> There is a 1% chance of causing <!-- -->